product_name,product_revenue,units_sold,order_count
MONSTERS STENCIL CRAFT,1773.37,1421,211
TEA TIME TABLE CLOTH,1769.25,118,35
SET OF 4 ENGLISH ROSE COASTERS,1765.8,1253,280
PETIT TRAY CHIC,1759.79,1047,146
PEACE WOODEN BLOCK LETTERS,1759.6200000000001,350,107
CHOCOLATE CALCULATOR,1758.75,935,199
MAGIC DRAWING SLATE PURDEY,1757.39,4624,158
OFFICE MUG WARMER CHOC+BLUE,1756.17,569,134
WRAP I LOVE LONDON ,1753.42,4451,106
RETROSPOT SMALL TUBE MATCHES,1753.25,1065,147
HOME SWEET HOME HANGING HEART,1752.35,1922,225
DOCTOR'S BAG SOFT TOY,1747.5,182,74
SILVER STARS TABLE DECORATION,1744.6100000000001,2037,213
BAKING MOULD TOFFEE CUP CHOCOLATE,1738.08,764,74
IF YOU CAN'T STAND THE HEAT MUG,1737.98,1530,120
CARD HOLDER GINGHAM HEART,1737.44,451,179
DOG BOWL VINTAGE CREAM,1736.63,385,127
"KEY FOB , GARAGE DESIGN",1733.27,2643,284
SET 36 COLOUR PENCILS DOLLY GIRL,1732.79,1375,148
3 ROSE MORRIS BOXED CANDLES,1732.0,1113,163
TOOL BOX SOFT TOY ,1728.84,174,106
DINOSAURS  WRITING SET ,1728.64,944,287
12 PENCILS TALL TUBE WOODLAND,1726.12,1957,253
PARTY CHARMS 50 PIECES,1725.26,2250,135
SET OF 16 VINTAGE RED CUTLERY,1723.6,159,59
SET OF 12  VINTAGE POSTCARD SET,1719.84,2182,143
SET OF 3 COLOURED  FLYING DUCKS,1717.5,148,49
ROUND STORAGE TIN VINTAGE LEAF,1717.03,927,117
ROBOT BIRTHDAY CARD,1715.48,3977,354
CARD MOTORBIKE SANTA,1706.88,4023,266
HANGING HEART MIRROR DECORATION ,1706.77,2339,291
BROCANTE SHELF WITH HOOKS,1706.57,155,81
GEORGIAN TRINKET BOX,1706.5,143,62
JINGLE BELL HEART ANTIQUE GOLD,1705.44,794,103
GINGHAM ROSE WRAP,1701.6,4080,156
BULL DOG BOTTLE TOP WALL CLOCK,1700.57,197,86
BAKING MOULD EASTER EGG WHITE CHOC,1698.6200000000001,586,79
SET 12 KIDS  WHITE CHALK STICKS,1698.57,4143,227
MINI JIGSAW SPACEBOY,1698.1200000000001,4478,176
MULTICOLOUR SPRING FLOWER MUG,1694.6899999999998,2523,138
SKULLS  WATER TRANSFER TATTOOS ,1690.23,1975,174
KINGS CHOICE GIANT TUBE MATCHES,1688.7,679,71
S/4 PINK FLOWER CANDLES IN BOWL,1687.85,905,193
STRAWBERRY BATH SPONGE ,1686.68,1185,229
SKULL AND CROSSBONES  GARLAND ,1686.5,1068,132
T-LIGHT HOLDER SWEETHEART HANGING,1686.27,859,139
AFGHAN SLIPPER SOCK PAIR,1683.65,407,24
GARLAND WITH HEARTS AND BELLS,1681.92,380,103
FRENCH TOILET SIGN BLUE METAL,1681.47,1337,189
SET 12 COLOUR PENCILS DOLLY GIRL ,1677.6,2376,234
WRAP SUKI AND FRIENDS,1677.0,4050,135
LIPSTICK PEN RED,1674.36,3341,273
HEART DECORATION PAINTED ZINC ,1672.79,2386,225
SET 12 COLOURING PENCILS DOILY,1670.55,2253,195
6 RIBBONS EMPIRE  ,1669.53,1260,225
PLAYING CARDS I LOVE LONDON ,1660.04,1207,115
WOODLAND DESIGN  COTTON TOTE BAG,1660.01,681,132
DAISY GARDEN MARKER,1658.57,1139,98
CAKE STAND LOVEBIRD 2 TIER WHITE,1657.7,210,95
SUNSET CHECK HAMMOCK,1657.42,192,62
CHARLIE + LOLA BISCUITS TINS,1653.97,456,121
RED COAT RACK PARIS FASHION,1653.35,348,114
PACK OF 12 WOODLAND TISSUES ,1652.6299999999999,5475,272
"SWISS ROLL TOWEL, CHOCOLATE  SPOTS",1652.27,901,94
SET OF 2 CERAMIC PAINTED HEARTS ,1650.6699999999998,-1607,128
SAVE THE PLANET COTTON TOTE BAG,1649.15,713,177
DAIRY MAID STRIPE MUG,1645.45,1855,90
WHEELBARROW FOR CHILDREN ,1643.76,121,85
HEART DECORATION RUSTIC HANGING ,1642.6,5064,341
HEART T-LIGHT HOLDER WILLIE WINKIE,1642.45,965,116
3 WHITE CHOC MORRIS BOXED CANDLES,1642.07,950,121
SKULLS PARTY BAG + STICKER SET,1640.05,1009,152
AIRLINE BAG VINTAGE JET SET BROWN,1639.29,354,170
CAT BOWL VINTAGE CREAM,1636.46,466,117
ANGEL DECORATION 3 BUTTONS ,1635.41,3742,165
 I LOVE LONDON MINI BACKPACK,1632.3200000000002,390,87
SWEETHEART WIRE FRUIT BOWL,1631.58,208,89
BLUE POLKADOT GARDEN PARASOL,1631.14,185,95
HANGING  BUTTERFLY T-LIGHT HOLDER,1625.12,1318,77
PENCIL CASE LIFE IS BEAUTIFUL,1624.76,475,131
SPACEBOY CHILDRENS EGG CUP,1623.38,1203,187
TV DINNER TRAY VINTAGE PAISLEY,1623.04,505,114
FOLDING UMBRELLA RED/WHITE POLKADOT,1621.76,347,120
HEN HOUSE DECORATION,1620.17,941,133
LAUREL HEART ANTIQUE SILVER,1613.82,1309,97
FOLDING BUTTERFLY MIRROR HOT PINK ,1613.3300000000002,2022,158
FRENCH LAUNDRY SIGN BLUE METAL,1608.8999999999999,962,145
HANGING CHICK  YELLOW DECORATION,1608.86,1139,112
STRAWBERRY HONEYCOMB  GARLAND ,1607.62,1288,110
SKULL DESIGN TV DINNER TRAY,1605.67,324,140
FOLKART STAR CHRISTMAS DECORATIONS,1604.9199999999998,3558,132
COFFEE MUG PINK PAISLEY DESIGN,1602.03,692,52
LADS ONLY TISSUE BOX,1599.35,1641,145
RED POLKADOT BEAKER ,1595.1899999999998,3851,138
METAL DECORATION NAUGHTY CHILDREN ,1594.79,1481,139
WALL MIRROR RECTANGLE DIAMANTE PINK,1590.55,204,89
PACK OF 12 SKULL TISSUES,1583.41,5275,232
SET 36 COLOUR PENCILS LOVE LONDON,1581.06,1105,126
POLYESTER FILLER PAD 45x45cm,1581.0,1600,144
COWBOYS AND INDIANS BIRTHDAY CARD ,1572.28,3741,274
CREAM FELT EASTER EGG BASKET,1572.23,903,116
RED VINTAGE SPOT BEAKER,1570.24,1840,200
PACK OF 6 HANDBAG GIFT BOXES,1567.8500000000001,572,113
SILK PURSE BABUSHKA PINK,1567.2,361,145
FRENCH BLUE METAL DOOR SIGN 1,1567.14,1172,209
PAPER CHAIN KIT SKULLS ,1566.99,548,97
WOOD STAMP SET THANK YOU,1564.8600000000001,1502,282
SNOWFLAKE PORTABLE TABLE LIGHT ,1563.55,510,128
SMALL HEART FLOWERS HOOK ,1560.85,1785,173
VINTAGE SEASIDE JIGSAW PUZZLES,1554.58,395,150
CABIN BAG VINTAGE PAISLEY,1548.27,80,37
RED RETROSPOT PURSE ,1546.27,418,159
BALLOON PUMP WITH 10 BALLOONS,1545.06,780,126
VINTAGE UNION JACK PENNANT,1543.85,773,104
POTTING SHED ROSE CANDLE,1541.1100000000001,476,28
FILIGREE HEART DAISY WHITE,1536.67,1199,99
HORSE & PONY WALL ART,1535.1299999999999,475,64
BLUE OWL SOFT TOY,1533.93,484,119
MULTICOLOUR HONEYCOMB PAPER GARLAND,1531.14,1119,75
REGENCY MIRROR WITH SHUTTERS,1530.0,10,7
TV DINNER TRAY DOLLY GIRL,1527.01,321,110
HEART CALCULATOR,1526.16,1167,134
FRENCH KITCHEN SIGN BLUE METAL,1525.16,1216,167
EMERGENCY FIRST AID TIN ,1523.52,1049,252
check,1522.53,99,47
CHRISTMAS RETROSPOT STAR WOOD,1521.1299999999999,1672,196
FIVE HEART HANGING DECORATION,1520.97,455,144
ROMANTIC PINKS RIBBONS ,1520.65,1218,225
CARD CHRISTMAS VILLAGE,1520.16,3561,247
3D CHRISTMAS STAMPS STICKERS ,1518.74,1158,144
CHERRY BLOSSOM  DECORATIVE FLASK,1516.96,344,135
ANT WHITE WIRE HEART SPIRAL,1515.68,338,105
PANTRY PASTRY BRUSH,1515.02,1131,214
DISCO BALL CHRISTMAS DECORATION,1512.92,12979,215
JUNGLE POPSICLES ICE LOLLY HOLDERS,1511.3600000000001,1079,183
VINTAGE BILLBOARD TEA MUG,1508.71,1255,88
MAGIC DRAWING SLATE DOLLY GIRL ,1507.64,3607,234
CALENDAR IN SEASON DESIGN,1505.24,582,110
TV DINNER TRAY AIR HOSTESS ,1505.02,419,106
SPACEBOY WALL ART,1504.49,479,50
"WRAP, BILLBOARD FONTS DESIGN",1500.44,3782,99
SPACEBOY TV DINNER TRAY,1500.27,273,135
CHRISTMAS TABLE CANDLE SILVER SPIKE,1499.3799999999999,1734,104
"DECORATION HEN ON NEST, HANGING",1494.9,871,120
FAUX FUR CHOCOLATE THROW,1494.69,88,49
IVORY WICKER HEART SMALL,1491.75,2271,130
WOODLAND BUNNIES LOLLY MAKERS,1488.65,652,124
MOUSE TOY WITH PINK T-SHIRT,1486.18,390,165
DAIRY MAID TRADITIONAL TEAPOT ,1485.1200000000001,204,121
MAGNETS PACK OF 4 SWALLOWS,1484.51,2492,252
SKULLS WRITING SET ,1484.13,864,252
4 VANILLA BOTANICAL CANDLES,1481.4,884,165
12 IVORY ROSE PEG PLACE SETTINGS,1476.85,850,151
MILK PAN RED RETROSPOT,1475.63,402,148
SET OF 4 SANTA PLACE SETTINGS,1471.95,1154,109
SET 12 COLOUR PENCILS LOVE LONDON,1464.38,1859,169
DINOSAUR KEYRINGS ASSORTED,1460.74,4448,181
CARD I LOVE LONDON ,1459.2,3493,218
FLOWER VINE RAFFIA FOOD COVER,1459.07,378,142
DRAWER KNOB CERAMIC BLACK,1457.37,985,89
WICKER WREATH LARGE,1456.45,737,152
MIRROR CORNICE,1455.8799999999999,90,66
LOVE LARGE WOOD LETTERS ,1454.96,85,73
RED ENCHANTED FOREST PLACEMAT,1454.8799999999999,678,110
PINK PAPER PARASOL ,1453.77,463,103
SET OF 4 ROSE BOTANICAL CANDLES,1451.99,-596,168
LARGE WHITE HONEYCOMB PAPER BELL  ,1451.82,562,95
EUCALYPTUS & PINECONE  WREATH,1450.51,346,80
TOY TIDY DOLLY GIRL DESIGN,1447.65,701,165
POLKADOT COFFEE CUP & SAUCER PINK,1443.33,1449,114
GLAMOROUS  MUG,1442.26,1280,144
CLASSIC FRENCH STYLE BASKET GREEN ,1439.77,327,79
FAIRY CAKE BIRTHDAY CANDLE SET,1438.49,391,104
SPACEBOY ROCKET LOLLY MAKERS,1435.51,643,114
ZINC  STAR T-LIGHT HOLDER ,1435.18,1212,48
BAG 500g SWIRLY MARBLES,1430.57,1439,144
ICE CREAM DESIGN GARDEN PARASOL,1429.82,210,73
FRENCH ENAMEL POT W LID,1428.1299999999999,573,120
CAST IRON HOOK GARDEN FORK,1421.83,458,24
BROWN CHECK CAT DOORSTOP ,1416.86,270,140
CHARLIE LOLA BLUE HOT WATER BOTTLE ,1416.05,284,144
CAKE STAND VICTORIAN FILIGREE SMALL,1415.63,371,124
"ELEPHANT, BIRTHDAY CARD, ",1415.2,3308,264
36 DOILIES DOLLY GIRL,1414.65,954,107
MAGIC DRAWING SLATE CIRCUS PARADE  ,1413.25,3384,200
"AIRLINE LOUNGE,METAL SIGN",1412.27,640,292
CARD BIRTHDAY COWBOY,1410.69,3475,226
SWALLOW WOODEN CHRISTMAS DECORATION,1410.21,1503,175
ENGLISH ROSE NOTEBOOK A7 SIZE,1407.52,3120,346
ANIMALS AND NATURE WALL ART,1406.06,414,50
IVORY PANTRY HANGING LAMP ,1405.42,118,46
SILVER MUG BONE CHINA TREE OF LIFE,1399.87,1157,115
12 COLOURED PARTY BALLOONS,1399.16,2135,164
PAPER LANTERN 9 POINT SNOW STAR ,1394.03,253,41
SET OF 4 DIAMOND NAPKIN RINGS,1389.84,165,39
CARD HOLDER LOVE BIRD LARGE ,1389.8,220,92
VINTAGE RED TRIM ENAMEL BOWL ,1389.23,1058,118
RIBBON REEL SOCKS AND MITTENS,1387.46,746,136
WOODLAND STORAGE BOX LARGE ,1386.27,301,76
EMPIRE GIFT WRAP,1384.0,3400,107
GROW YOUR OWN HERBS SET OF 3,1383.79,156,93
SET/4 SPRING FLOWER DECORATION,1383.08,1140,129
PACK OF 12 VINTAGE CHRISTMAS TISSUE,1380.23,3027,156
PACK OF 6 LARGE FRUIT STRAWS ,1380.0,2247,153
VINTAGE BILLBOARD DRINK ME MUG,1378.92,908,180
ROSE SCENT CANDLE IN JEWELLED BOX,1376.07,25,72
WRAP PAISLEY PARK ,1375.5,3275,120
FRENCH BLUE METAL DOOR SIGN 2,1375.32,1007,195
PENS ASSORTED SPACEBALL,1374.94,5910,156
GIN & TONIC DIET GREETING CARD ,1374.1,3183,250
CIRCUS PARADE CHILDRENS EGG CUP ,1374.01,1054,145
CERAMIC BOWL WITH STRAWBERRY DESIGN,1370.4,584,125
SET OF 6 3D KIT CARDS FOR KIDS,1368.75,1488,223
ASSORTED BOTTLE TOP  MAGNETS ,1368.62,2858,189
COFFEE MUG BLUE PAISLEY DESIGN,1368.18,767,61
CARD CIRCUS PARADE,1365.95,3213,288
DANISH ROSE PHOTO FRAME,1360.15,1259,107
VINTAGE RED ENAMEL TRIM PLATE,1358.19,799,88
CARDHOLDER GINGHAM CHRISTMAS TREE,1353.36,390,93
SET/10 IVORY POLKADOT PARTY CANDLES,1353.34,1121,155
TRAVEL CARD WALLET TRANSPORT,1352.74,3132,282
SMALL RED BABUSHKA NOTEBOOK ,1352.17,1953,266
VINTAGE EMBOSSED HEART,1351.43,1030,118
4 LAVENDER BOTANICAL DINNER CANDLES,1349.17,866,136
LIPSTICK PEN FUSCHIA,1346.68,2596,214
HOME SMALL WOOD LETTERS,1344.54,212,132
PAPER CHAIN KIT LONDON,1343.34,458,97
HANGING CHICK GREEN DECORATION,1341.6699999999998,907,122
ZINC BOX SIGN HOME,1338.95,137,65
CARD HOLDER LOVE BIRD SMALL,1338.6399999999999,328,74
PACK OF 6 SKULL PAPER CUPS,1338.2,2100,173
HERB MARKER ROSEMARY,1336.97,1932,241
"FEATHER PEN,COAL BLACK",1335.58,2506,179
BASKET OF TOADSTOOLS,1334.67,1022,131
WALL ART VINTAGE HEART,1334.49,332,32
OCEAN SCENT CANDLE IN JEWELLED BOX,1331.24,284,91
CERAMIC PIRATE CHEST MONEY BANK,1329.3999999999999,858,146
MAKE YOUR OWN PLAYTIME CARD KIT,1327.31,641,102
RED RETROSPOT BIG BOWL,1326.8799999999999,190,100
CHARLIE & LOLA WASTEPAPER BIN FLORA,1323.37,996,118
RED RETROSPOT SHOPPING BAG,1323.0900000000001,511,92
GLITTER CHRISTMAS HEART ,1322.5,2610,164
PIG KEYRING WITH LIGHT & SOUND ,1321.97,1327,83
MAGNETS PACK OF 4 CHILDHOOD MEMORY,1317.08,1128,101
HOME SWEET HOME 2 DRAWER CABINET,1316.43,253,71
REINDEER HEART DECORATION SILVER,1315.73,1479,148
HERB MARKER BASIL,1314.89,1900,244
VINTAGE CHRISTMAS PAPER GIFT BAG,1313.3899999999999,1608,100
YELLOW COAT RACK PARIS FASHION,1312.69,281,102
MEDINA STAMPED METAL STOOL,1311.69,36,22
DIAMANTE RING ASSORTED IN BOX.,1311.3600000000001,628,23
NO JUNK MAIL METAL SIGN,1310.75,1856,269
PINK  HONEYCOMB PAPER BALL ,1308.56,662,82
HERB MARKER THYME,1308.36,1896,238
VINTAGE UNION JACK DOORSTOP,1307.76,212,97
PENNY FARTHING BIRTHDAY CARD,1304.14,2992,265
BOOM BOX SPEAKER BOYS,1301.55,301,101
ELEPHANT CARNIVAL POUFFE,1299.83,31,48
RED RETROSPOT STORAGE JAR,1298.64,268,72
CLASSIC FRENCH STYLE BASKET BROWN,1296.6100000000001,264,75
IVORY KNITTED MUG COSY ,1296.23,668,109
UNION JACK FLAG LUGGAGE TAG,1296.1299999999999,750,193
SMALL HANGING IVORY/RED WOOD BIRD,1295.17,2643,262
PORCELAIN ROSE SMALL,1291.6000000000001,1548,66
CERAMIC CAKE DESIGN SPOTTED PLATE,1289.3899999999999,803,121
4 PEAR BOTANICAL DINNER CANDLES,1288.34,822,138
SPOTTY PINK DUCK DOORSTOP,1286.71,287,118
AIRLINE BAG VINTAGE WORLD CHAMPION ,1285.24,281,151
SAVOY ART DECO CLOCK,1280.1299999999999,180,67
TRAVEL CARD WALLET RETRO PETALS,1279.05,2957,224
FRENCH BLUE METAL DOOR SIGN No,1278.38,995,167
HANGING PHOTO CLIP ROPE LADDER,1277.47,748,86
"KEY FOB , BACK DOOR ",1274.64,1824,310
SET OF 72 SKULL PAPER  DOILIES,1271.52,884,103
HERB MARKER PARSLEY,1270.8,1862,239
POTTING SHED CANDLE CITRONELLA,1268.1899999999998,443,5
GLITTER HEART GARLAND WITH BELLS ,1267.22,92,94
BLACK ENCHANTED FOREST PLACEMAT,1266.91,698,71
"KEY FOB , FRONT  DOOR ",1264.97,1966,212
SET/6 COLLAGE PAPER PLATES,1264.19,2193,221
ROCOCO WALL MIRROR WHITE,1256.94,28,59
ROCKING HORSE GREEN CHRISTMAS ,1255.72,1058,180
6 ROCKET BALLOONS ,1252.92,1836,200
DOLLY GIRL CHILDRENS EGG CUP,1252.61,950,136
FRENCH ENAMEL WATER BASIN,1250.61,403,130
HANGING ENGRAVED METAL HEART,1249.1100000000001,297,78
EMBROIDERED RIBBON REEL EMILY ,1245.77,568,99
FRIDGE MAGNETS US DINER ASSORTED,1239.6,1311,108
ASS FLORAL PRINT MULTI SCREWDRIVER,1239.12,2838,168
GLASS JAR PEACOCK BATH SALTS,1232.0900000000001,381,144
PARTY CONES CANDY TREE DECORATION,1231.52,1194,100
CHARLIE AND LOLA TABLE TINS,1230.78,496,85
WALL ART LOVES' SECRET ,1227.95,247,41
CHRISTMAS RETROSPOT TREE WOOD,1226.03,1376,173
STAR DECORATION PAINTED ZINC ,1222.3999999999999,4662,182
6 RIBBONS SHIMMERING PINKS ,1221.52,1391,200
200 RED + WHITE BENDY STRAWS,1221.43,918,172
SINGLE WIRE HOOK IVORY HEART,1221.36,872,83
CHRISTMAS MUSICAL ZINC HEART ,1218.8799999999999,2788,188
PAPER BUNTING VINTAGE PARTY,1218.48,428,47
FANNY'S REST STOPMETAL SIGN,1217.73,209,144
WHITE HANGING BEADS CANDLE HOLDER,1217.7,385,51
HERB MARKER MINT,1216.66,1745,241
PACK OF 20 SPACEBOY NAPKINS,1214.11,1528,146
4 IVORY DINNER CANDLES SILVER FLOCK,1213.29,541,136
CARDHOLDER GINGHAM STAR,1212.82,379,79
KITCHEN METAL SIGN,1212.35,2048,306
METAL MERRY CHRISTMAS WREATH,1210.37,503,92
SMALL WHITE RETROSPOT MUG IN BOX ,1207.55,444,91
SET OF 2 CHRISTMAS DECOUPAGE CANDLE,1202.27,1164,166
SET OF 36 DOILIES SPACEBOY DESIGN ,1202.12,862,77
IVORY WIRE KITCHEN ORGANISER,1201.27,119,42
PACK OF 12 PINK POLKADOT TISSUES,1197.73,4067,189
WRAP CIRCUS PARADE,1192.34,2877,105
SMALL PURPLE BABUSHKA NOTEBOOK ,1190.51,1690,251
MEASURING TAPE BABUSHKA BLUE,1188.74,431,80
VINTAGE BILLBOARD MUG ,1186.23,1107,107
WHITE GOOSE FEATHER CHRISTMAS TREE ,1185.31,330,81
RED RETROSPOT PUDDING BOWL,1183.46,198,69
PINK FAIRY CAKE CUSHION COVER,1182.99,285,89
MAGIC SHEEP WOOL GROWING FROM PAPER,1181.99,1145,116
HANGING FAIRY CAKE DECORATION,1181.79,641,77
RIBBON REEL FLORA + FAUNA ,1176.5,644,139
HERB MARKER CHIVES ,1176.32,1709,210
S/4 IVORY MINI ROSE CANDLE IN BOWL,1174.6299999999999,806,172
LARGE ROUND WICKER PLATTER ,1173.53,195,91
BOOM BOX SPEAKER GIRLS,1172.48,564,90
DRAWER KNOB VINTAGE GLASS STAR,1171.92,543,64
LAVENDER TOILETTE BOTTLE,1168.08,558,79
LARGE RED BABUSHKA NOTEBOOK ,1167.74,1096,164
12 PENCILS TALL TUBE POSY,1166.94,3920,174
ORANGE TV TRAY TABLE ,1165.9099999999999,497,46
EMBROIDERED RIBBON REEL DAISY ,1164.98,579,71
MINI PLAYING CARDS DOLLY GIRL ,1164.29,2629,121
SET OF 2 CERAMIC CHRISTMAS TREES,1163.1299999999999,-654,95
NATURAL HANGING QUILTED HEARTS ,1162.1000000000001,1438,75
DINOSAUR PARTY BAG + STICKER SET,1160.71,707,101
MINI PLAYING CARDS BUFFALO BILL ,1156.51,2884,119
EGG CUP MILKMAID HEIDI,1154.43,879,84
DECORATIVE ROSE BATHROOM BOTTLE,1154.17,1170,163
GROW YOUR OWN FLOWERS SET OF 3,1153.85,285,85
TREASURE AHOY WALL ART,1151.31,354,42
DECORATIVE CATS BATHROOM BOTTLE,1151.15,1094,187
HOME SWEEET HOME 3 PEG HANGER ,1151.03,297,68
WRAP DOLLY GIRL,1149.5,2775,101
PINK DIAMANTE PEN IN GIFT BOX,1147.57,412,104
CUT GLASS HEXAGON T-LIGHT HOLDER,1147.4099999999999,109,23
GEMSTONE CHANDELIER T-LIGHT HOLDER,1147.37,63,52
TRIANGULAR POUFFE VINTAGE ,1146.7,62,34
SET OF 2 TINS VINTAGE BATHROOM ,1145.15,208,101
SET/4 RED MINI ROSE CANDLE IN BOWL,1144.08,745,192
APRON MODERN VINTAGE COTTON,1143.76,444,92
SMALL HAMMERED SILVER CANDLEPOT ,1143.31,286,51
PORCELAIN T-LIGHT HOLDERS ASSORTED,1142.77,232,106
SET OF 6 HEART CHOPSTICKS,1142.15,813,152
AIRLINE BAG VINTAGE JET SET WHITE,1141.7,255,123
MINI PLAYING CARDS SPACEBOY ,1139.2,2747,146
FRENCH BLUE METAL DOOR SIGN 3,1139.06,854,169
BLUE POLKADOT BEAKER ,1137.5,2796,94
WOOD STOCKING CHRISTMAS SCANDISPOT,1137.28,1569,178
GREEN ROSE WASHBAG,1136.6,217,162
PIN CUSHION BABUSHKA PINK,1135.18,439,133
LARGE PINK GLASS SUNDAE DISH,1133.8,987,84
MINI JIGSAW DOLLY GIRL,1130.58,2921,136
CANDY SPOT CUSHION COVER,1127.04,322,127
CARD PSYCHEDELIC APPLES,1123.88,2640,268
FRENCH BLUE METAL DOOR SIGN 5,1122.79,826,161
PENS ASSORTED FUNKY JEWELED ,1120.15,5240,145
CHRISTMAS HANGING TREE WITH BELL,1119.56,1898,120
MINI PLAYING CARDS GYMKHANA,1119.22,2522,120
RED FLOWER CROCHET FOOD COVER,1116.89,304,112
CARD SUKI BIRTHDAY,1114.81,2639,290
STAR DECORATION RUSTIC,1114.29,2336,144
 TRELLIS COAT RACK,1113.6599999999999,226,57
LARGE PURPLE BABUSHKA NOTEBOOK  ,1112.75,1197,178
50'S CHRISTMAS PAPER GIFT BAG,1108.07,1351,104
CHERUB HEART DECORATION SILVER ,1107.28,1272,92
ASSORTED CREEPY CRAWLIES,1107.07,1212,108
CARD GINGHAM ROSE ,1106.17,2717,163
ANGEL DECORATION STARS ON DRESS,1104.8500000000001,2583,134
"BIRTHDAY CARD, RETRO SPOT",1104.81,2608,270
EMBROIDERED RIBBON REEL SUSIE ,1101.78,560,71
SILVER PLATE CANDLE BOWL SMALL,1101.28,11,58
PACK OF 12 PINK PAISLEY TISSUES ,1099.55,3413,214
RED RETROSPOT TISSUE BOX,1098.23,2107,205
ORGANISER WOOD ANTIQUE WHITE ,1094.8,117,89
BIRDS MOBILE VINTAGE DESIGN,1093.72,180,77
TEA COSY RED  STRIPE,1093.6,370,121
TEA TIME DES TEA COSY,1091.22,378,112
PRETTY HANGING QUILTED HEARTS,1090.02,1278,74
SQUARECUSHION COVER PINK UNION FLAG,1087.57,245,74
MOBILE VINTAGE HEARTS ,1086.95,237,99
SILVER HEARTS TABLE DECORATION,1086.65,1288,157
CAKE STAND LOVEBIRD 2 TIER PINK,1084.6399999999999,129,53
TRAVEL CARD WALLET UNION JACK,1083.17,2517,230
SMALL SQUARE CUT GLASS CANDLESTICK,1081.79,182,54
YELLOW METAL CHICKEN HEART ,1079.67,731,94
PAPER LANTERN 9 POINT SNOW STAR,1078.88,248,55
POLKA DOT RAFFIA FOOD COVER,1077.82,288,91
VINTAGE UNION JACK SHOPPING BAG,1077.03,225,46
ZINC  HEART T-LIGHT HOLDER,1071.91,853,70
HOME GARLAND PAINTED ZINC ,1071.38,961,130
HANGING QUILTED PATCHWORK APPLES,1069.5700000000002,1211,92
PING MICROWAVE APRON,1069.1699999999998,509,122
PAINTED METAL STAR WITH HOLLY BELLS,1068.01,1790,119
GROW YOUR OWN PLANT IN A CAN ,1067.8700000000001,1341,65
GLITTER CHRISTMAS STAR ,1067.82,2459,125
DRAWER KNOB CERAMIC RED,1067.6,720,74
CHOCOLATE 3 WICK MORRIS BOX CANDLE,1066.82,585,72
"HOOK, 1 HANGER ,MAGIC GARDEN",1066.6,1111,102
BOHEMIAN COLLAGE STATIONERY SET,1065.82,623,212
"DECORATION , WOBBLY RABBIT , METAL ",1065.39,1102,116
SET/4 SKULL BADGES,1065.0,902,167
EMBROIDERED RIBBON REEL SOPHIE  ,1062.35,297,42
DECORATIVE WICKER HEART SMALL,1062.28,1596,109
BALLOON ART MAKE YOUR OWN FLOWERS,1058.69,1022,98
FRENCH LAVENDER SCENT HEART,1058.14,708,109
FLOWERS CHANDELIER T-LIGHT HOLDER,1057.8000000000002,177,47
LOCAL CAFE MUG,1057.71,676,116
SET OF 6 STRAWBERRY CHOPSTICKS,1054.44,801,144
WOOD STAMP SET FLOWERS,1054.44,961,197
LARGE CHINESE STYLE SCISSOR,1053.45,1273,65
PLACE SETTING WHITE STAR,1051.82,2225,108
LOVE HEART TRINKET POT,1049.1,2250,137
GLASS JAR MARMALADE ,1048.25,354,88
"WHITE TEA,COFFEE,SUGAR JARS",1047.96,584,72
"METAL SIGN,CUPCAKE SINGLE HOOK",1047.75,1094,148
VINTAGE BEAD PINK PURSE ,1047.57,900,132
HANGING CLEAR MINI BOTTLE,1046.4199999999998,1726,43
BLACK CANDELABRA T-LIGHT HOLDER,1043.8799999999999,911,91
HOME SWEET HOME BOTTLE ,1043.72,473,87
VINTAGE KID DOLLY CARD ,1041.94,2478,214
TRAVEL CARD WALLET SUKI,1041.42,2340,269
"ART LIGHTS,FUNK MONKEY",1037.54,443,63
SLEEPING CAT ERASERS,1035.96,4934,291
I LOVE LONDON BEAKER,1034.8,826,100
ZINC HEART FLOWER T-LIGHT HOLDER,1033.28,795,79
LARGE CAKE STAND HANGING HEARTS,1031.75,200,42
GREY FLORAL FELTCRAFT SHOULDER BAG,1031.69,190,85
CHRISTMAS TREE STAR DECORATION,1031.56,2372,200
WHITE TALL PORCELAIN T-LIGHT HOLDER,1029.41,407,71
RAINY LADIES BIRTHDAY CARD,1028.77,2368,215
SKULLS  STICKERS,1028.58,1140,138
SET OF 6 KASHMIR FOLKART BAUBLES,1026.21,845,91
WRAP RED DOILEY,1025.6,2480,84
3D DOG PICTURE PLAYING CARDS,1025.57,341,86
EMPIRE TISSUE BOX,1024.47,1984,168
HEART STRING MEMO HOLDER HANGING,1023.03,760,125
SANDWICH BATH SPONGE,1022.8,526,101
3D HEARTS  HONEYCOMB PAPER GARLAND,1021.9,326,50
MAGNETS PACK OF 4 VINTAGE COLLAGE,1020.5799999999999,1711,153
HEART MINI PORTRAIT FRAME,1019.81,517,88
IVORY ENCHANTED FOREST PLACEMAT,1019.7,512,92
CAST IRON HOOK GARDEN TROWEL,1018.19,183,28
PURPLE PAPER PARASOL,1017.89,311,90
DISCO BALL ROTATOR BATTERY OPERATED,1017.0,240,109
BLUE POT PLANT CANDLE ,1015.85,284,71
RED HEARTS LIGHT CHAIN ,1014.76,497,64
KIDS RAIN MAC BLUE,1014.14,1275,88
"FEATHER PEN,LIGHT PINK",1013.4599999999999,1987,151
4 LILY  BOTANICAL DINNER CANDLES,1013.01,528,102
FRENCH BLUE METAL DOOR SIGN 4,1011.78,752,160
PACK OF 12 SPACEBOY TISSUES,1010.47,2997,223
TOAST ITS - BEST MUM,1010.21,801,95
WHITE WIRE PLANT POT HOLDER,1009.51,359,73
STRIPEY CHOCOLATE NESTING BOXES,1009.06,312,112
EASTER TIN CHICKS PINK DAISY,1007.87,583,109
WALL ART MID CENTURY MODERN ,1007.53,163,21
FRIDGE MAGNETS LES ENFANTS ASSORTED,1006.97,1190,88
POCKET BAG BLUE PAISLEY RED SPOT,1005.9,833,129
ZINC SWEETHEART WIRE LETTER RACK,1005.69,259,91
FRENCH GARDEN SIGN BLUE METAL,1004.83,782,132
SCHOOL DESK AND CHAIR ,1004.75,16,15
PACK OF 6 COCKTAIL PARASOL STRAWS,1002.5400000000001,2506,111
WICKER WREATH SMALL,1001.4899999999999,741,123
FOLDING BUTTERFLY MIRROR RED  ,1000.82,1280,101
TOAST ITS - I LOVE YOU ,998.83,667,122
WALL ART GARDEN HAVEN ,998.64,215,36
CHERRY CROCHET FOOD COVER,996.89,262,106
BROWN  PIRATE TREASURE CHEST ,996.8,416,146
EMBROIDERED RIBBON REEL REBECCA ,996.38,334,63
MINI FUNKY DESIGN TAPES,994.84,1296,91
GLITTER STAR GARLAND WITH BELLS ,992.05,239,63
ASSORTED TUTTI FRUTTI SMALL PURSE,991.54,606,68
SET OF 6 T-LIGHTS EASTER CHICKS,985.77,327,76
SET/3 DECOUPAGE STACKING TINS,982.62,217,73
SET OF 3 BIRD LIGHT PINK FEATHER ,982.0699999999999,1860,225
SET OF 2 TINS JARDIN DE PROVENCE,980.7,253,96
SET OF 6 CAKE CHOPSTICKS,979.48,641,153
ASSORTED EASTER GIFT TAGS,977.76,1111,62
EMBROIDERED RIBBON REEL ROSIE,977.3199999999999,501,57
BOX OF 9 PEBBLE CANDLES,976.48,425,106
SET/3 CHRISTMAS DECOUPAGE CANDLES,976.27,832,72
BOUDOIR SQUARE TISSUE BOX,973.0799999999999,1919,178
PINK METAL CHICKEN HEART ,970.27,657,94
PACK OF 12 VINTAGE DOILY TISSUES,969.4599999999999,2308,123
CREAM SWEETHEART LETTER RACK,966.95,201,35
VINTAGE BEAD PINK SCARF ,966.04,439,59
EMBROIDERED RIBBON REEL RACHEL ,965.9599999999999,356,45
IVORY HANGING DECORATION  BIRD,965.93,1115,129
SET OF 4 FAIRY CAKE PLACEMATS ,965.41,519,68
EMBROIDERED RIBBON REEL SALLY ,964.9100000000001,472,75
SMALL GLASS SUNDAE DISH CLEAR,964.4,700,65
WHITE SOAP RACK WITH 2 BOTTLES,963.85,171,49
MINI JIGSAW CIRCUS PARADE ,960.44,2518,92
WOOD STAMP SET BEST WISHES,959.7,1019,187
ENGLISH ROSE SPIRIT LEVEL ,959.38,974,119
ZINC HEART LATTICE T-LIGHT HOLDER,958.57,717,88
WOOD STAMP SET HAPPY BIRTHDAY,958.4100000000001,938,174
FRENCH BLUE METAL DOOR SIGN 6,958.34,716,134
PARTY INVITES WOODLAND,958.01,1145,123
SWEETHEART WALL TIDY ,957.3299999999999,103,47
SMALL CHOCOLATES PINK BOWL,957.3,1783,248
SOFT PINK ROSE TOWEL ,952.83,198,125
SCOTTIE DOGS BABY BIB,951.1099999999999,1993,246
FELT EGG COSY CHICKEN,949.61,1022,139
WHITE HEART CONFETTI IN TUBE,948.71,957,73
MEDIUM MEDINA STAMPED METAL BOWL ,948.6999999999999,272,59
CHRISTMAS MUSICAL ZINC STAR,947.36,1929,124
WALL ART THE MAGIC FOREST ,947.0600000000001,150,14
EASTER TIN BUCKET,946.9300000000001,371,43
TRAVEL CARD WALLET RETROSPOT,945.6,2167,224
BLUE PAPER PARASOL ,943.88,293,62
HI TEC ALPINE HAND WARMER,943.16,833,108
MAGIC GARDEN FELT GARLAND ,939.37,419,91
5 HOOK HANGER MAGIC TOADSTOOL,938.28,563,40
VINTAGE BEAD PINK EVENING BAG,937.25,619,94
MOTHER'S KITCHEN SPOON REST ,937.17,218,87
EASTER TREE YELLOW BIRDS,935.39,132,63
DANISH ROSE ROUND SEWING BOX,934.79,807,64
JIGSAW TREE WITH BIRDHOUSE,934.7099999999999,931,153
DOLLY MIXTURE CHILDREN'S UMBRELLA,932.42,175,78
"NURSERY A,B,C PAINTED LETTERS",932.4,198,73
BLUE POLKADOT WASHING UP GLOVES,930.95,362,152
CLOCK MAGNET MUM'S KITCHEN,930.48,324,53
FRIDGE MAGNETS LA VIE EN ROSE,929.65,982,93
JAM CLOCK MAGNET,929.47,325,71
RED LOVE HEART SHAPE CUP,928.8299999999999,1026,155
OFFICE MUG WARMER PINK,927.33,315,66
PINK HORSE SOCK PUPPET,923.99,249,76
GOLD MUG BONE CHINA TREE OF LIFE,923.74,731,79
MINI CAKE STAND T-LIGHT HOLDER,922.2,1809,148
PORCELAIN BUTTERFLY OIL BURNER,921.87,143,65
VANILLA INCENSE IN TIN,920.67,2084,95
HAPPY EASTER HANGING DECORATION,920.06,237,56
CHRISTMAS TREE HEART DECORATION,919.98,2124,181
3 GARDENIA MORRIS BOXED CANDLES,919.27,440,82
LARGE MEDINA STAMPED METAL BOWL ,916.11,167,58
TEA PARTY  WRAPPING PAPER ,914.72,2216,77
WOVEN ROSE GARDEN CUSHION COVER ,912.03,217,90
 NINE DRAWER OFFICE TIDY,909.37,59,33
POLKADOT RAIN HAT ,909.01,1853,229
POTTING SHED SEED ENVELOPES,908.33,557,131
CHILDS GARDEN BRUSH PINK,906.75,394,91
TOMATO CHARLIE+LOLA COASTER SET,905.5500000000001,512,88
EGG FRYING PAN RED ,902.92,425,110
IVORY PILLAR CANDLE SILVER FLOCK,902.24,446,77
WALL ART WORK REST AND PLAY  ,901.5799999999999,210,31
JOY WOODEN BLOCK LETTERS,901.46,232,89
PINK FLOWER CROCHET FOOD COVER,897.8,237,79
COSMETIC BAG VINTAGE ROSE PAISLEY,897.74,417,100
PLAYING CARDS VINTAGE DOILEY ,896.41,714,94
HIPPY CHIC DECORATIVE PARASOL,896.01,169,27
CARD PARTY GAMES ,893.51,2141,235
TEA TIME TEA SET IN GIFT BOX,892.9300000000001,119,52
DANISH ROSE FOLDING CHAIR,890.4000000000001,110,27
BEADED PEARL HEART WHITE ON STICK,890.21,983,122
MARIE ANTOINETTE TRINKET BOX SILVER,889.76,212,33
WHITE HONEYCOMB PAPER GARLAND ,888.67,355,72
GUMBALL MONOCHROME COAT RACK,884.55,331,119
CHILDRENS GARDEN GLOVES BLUE,883.1999999999999,586,87
