product_name,product_revenue,units_sold,order_count
DOTCOM POSTAGE,206245.48,1707,710
REGENCY CAKESTAND 3 TIER,164762.19,12980,2172
WHITE HANGING HEART T-LIGHT HOLDER,99846.98,39122,2313
PARTY BUNTING,98302.98,18022,1706
JUMBO BAG RED RETROSPOT,92356.03,47363,2135
mailout,83786.1,44082,2173
RABBIT NIGHT LIGHT,66756.59,30646,1025
POSTAGE,66230.64,6353,1254
PAPER CHAIN KIT 50'S CHRISTMAS ,63791.94,18902,1170
ASSORTED COLOUR BIRD ORNAMENT,58959.729999999996,36221,1468
CHILLI LIGHTS,53768.06,10343,673
PICNIC BASKET WICKER SMALL,51041.37,1873,478
SMALL POPCORN HOLDER,50987.47,56450,1442
SPOTTY BUNTING,42700.02,8534,1159
JUMBO BAG PINK POLKADOT,41619.66,21009,1231
BLACK RECORD COVER FRAME,40596.96,11616,381
SET OF 3 CAKE TINS PANTRY DESIGN ,37413.44,7286,1462
DOORMAT KEEP CALM AND COME IN,36565.39,5264,739
JAM MAKING SET WITH JARS,36116.09,8470,1220
WOOD BLACK BOARD ANT WHITE FINISH,35859.27,5996,696
LUNCH BAG RED RETROSPOT,35187.31,18979,1608
HOT WATER BOTTLE TEA AND SYMPATHY,32692.49,5591,652
VICTORIAN GLASS HANGING T-LIGHT,32549.57,23854,1062
JUMBO BAG STRAWBERRY,32354.04,16081,840
CHOCOLATE HOT WATER BOTTLE,32317.3,5898,866
PAPER CHAIN KIT VINTAGE CHRISTMAS,31941.89,10253,832
HEART OF WICKER SMALL,31899.850000000002,17791,1214
SET OF 3 REGENCY CAKE TINS,30756.45,6267,910
ALARM CLOCK BAKELIKE RED ,30423.62,7741,1081
JUMBO STORAGE BAG SUKI,30167.79,13320,1201
HEART OF WICKER LARGE,29949.91,9830,944
JUMBO BAG APPLES,29166.4,14197,999
CHARLOTTE BAG SUKI DESIGN,29164.36,18003,895
HOT WATER BOTTLE KEEP CALM,28424.95,5745,790
JUMBO SHOPPER VINTAGE RED PAISLEY,28012.48,12248,1187
NATURAL SLATE HEART CHALKBOARD ,27995.36,9120,1266
ROSES REGENCY TEACUP AND SAUCER ,27944.920000000002,9441,1120
DOORMAT RED RETROSPOT,27621.32,4027,704
JUMBO  BAG BAROQUE BLACK WHITE,27581.32,13641,947
ALARM CLOCK BAKELIKE GREEN,27039.03,6384,1003
JUMBO BAG ALPHABET,26814.15,12785,920
RED  HARMONICA IN BOX ,26247.83,22066,671
ROTATING SILVER ANGELS T-LIGHT HLDR,26142.23,100,453
RECIPE BOX PANTRY YELLOW DESIGN,25819.55,8146,1164
SPACEBOY LUNCH BOX ,25647.77,14206,908
ANTIQUE SILVER TEA GLASS ETCHED,25516.67,18911,932
DOORMAT UNION FLAG,25512.1,3750,623
JAM MAKING SET PRINTED,25235.23,16081,1174
PLEASE ONE PERSON METAL SIGN,25120.88,12576,862
REGENCY TEAPOT ROSES ,24482.53,2718,429
SET OF 6 SPICE TINS PANTRY DESIGN,24365.66,5928,848
ROUND SNACK BOXES SET OF4 WOODLAND ,24317.670000000002,8519,749
VINTAGE UNION JACK BUNTING,24304.83,2331,483
DOORMAT NEW ENGLAND,24261.04,3826,602
SCOTTIE DOG HOT WATER BOTTLE,23965.39,4537,778
BAKING SET 9 PIECE RETROSPOT ,23928.62,4880,961
RED TOADSTOOL LED NIGHT LIGHT,23651.68,13823,861
CREAM HEART CARD HOLDER,23431.87,8283,529
EDWARDIAN PARASOL NATURAL,23424.32,4024,547
JUMBO BAG 50'S CHRISTMAS ,23328.79,10044,723
GIN + TONIC DIET METAL SIGN,23298.74,10177,817
RED HANGING HEART T-LIGHT HOLDER,23075.79,7825,754
VINTAGE UNION JACK MEMOBOARD,22970.29,3268,225
SET OF TEA COFFEE SUGAR TINS PANTRY,22968.62,4688,505
JUMBO BAG PINK VINTAGE PAISLEY,22794.07,10785,877
RETROSPOT TEA SET CERAMIC 11 PC ,22717.51,4559,983
JUMBO BAG OWLS,22599.53,9159,674
PAPER BUNTING RETROSPOT,22594.56,7516,806
WOODEN PICTURE FRAME WHITE FINISH,22531.71,8773,1118
GREEN REGENCY TEACUP AND SAUCER,22433.25,7161,1057
LUNCH BAG SUKI  DESIGN ,22318.64,12405,1306
PINK 3 PIECE POLKADOT CUTLERY SET,22285.54,5395,549
CREAM SWEETHEART MINI CHEST,22248.15,1751,544
LUNCH BAG  BLACK SKULL.,22219.01,12112,1295
DOORMAT HEARTS,22114.72,3418,595
RED WOOLLY HOTTIE WHITE HEART.,21888.53,4660,438
JUMBO BAG WOODLAND ANIMALS,21665.96,9533,872
RED RETROSPOT CHARLOTTE BAG,21606.48,17548,1050
DOORMAT FANCY FONT HOME SWEET HOME,21561.64,3241,505
LUNCH BAG CARS BLUE,21423.13,11603,1173
DOLLY GIRL LUNCH BOX,21156.489999999998,11518,860
PACK OF 72 RETROSPOT CAKE CASES,21059.72,36039,1334
WOODEN FRAME ANTIQUE WHITE ,20941.44,6572,992
LUNCH BAG APPLE DESIGN,20814.83,12124,1049
COOK WITH WINE METAL SIGN ,20796.54,10153,735
JUMBO BAG SCANDINAVIAN PAISLEY,20670.02,10205,816
ALARM CLOCK BAKELIKE PINK,20548.4,5323,799
LUNCH BOX I LOVE LONDON,20272.7,11201,725
WHITE SKULL HOT WATER BOTTLE ,19958.52,4486,504
DOORMAT FAIRY CAKE,19333.91,2886,369
RED 3 PIECE RETROSPOT CUTLERY SET,18971.39,4544,440
RED RETROSPOT CAKE STAND,18884.75,1628,582
HOMEMADE JAM SCENTED CANDLES,18602.75,12392,654
GUMBALL COAT RACK,18552.97,7877,714
PICNIC BASKET WICKER LARGE,18448.96,1467,472
LUNCH BAG WOODLAND,18188.48,9852,1037
SET/5 RED RETROSPOT LID GLASS BOWLS,18089.35,6265,914
ASSORTED COLOURS SILK FAN,18064.16,22552,523
WOOD S/3 CABINET ANT WHITE FINISH,17881.32,2080,626
LUNCH BAG SPACEBOY DESIGN ,17850.01,10305,1170
GROW A FLYTRAP OR SUNFLOWER IN TIN,17837.45,16172,307
HAND WARMER OWL DESIGN,17651.98,8366,667
RETROSPOT HEART HOT WATER BOTTLE,17609.53,3513,631
ROUND SNACK BOXES SET OF 4 FRUITS ,17438.87,6189,597
COLOUR GLASS. STAR T-LIGHT HOLDER,17214.94,5536,351
LUNCH BAG PINK POLKADOT,17198.99,10363,1110
PINK REGENCY TEACUP AND SAUCER,17164.26,5626,802
6 RIBBONS RUSTIC CHARM,17149.27,9149,961
HOME BUILDING BLOCK WORD,16931.32,2760,787
HOT BATHS METAL SIGN,16913.6,7240,625
JUMBO BAG SPACEBOY DESIGN,16866.72,8566,692
BLUE 3 PIECE POLKADOT CUTLERY SET,16852.72,3321,400
SET OF 4 KNICK KNACK TINS DOILEY ,16830.82,4136,553
MINI PAINT SET VINTAGE ,16810.42,26437,390
WOODLAND CHARLOTTE BAG,16672.35,13198,843
SET OF 4 PANTRY JELLY MOULDS,16422.23,12604,1082
HOT WATER BOTTLE I AM SO POORLY,16375.41,3080,663
IVORY KITCHEN SCALES,16360.01,1907,724
HANGING HEART JAR T-LIGHT HOLDER,16270.94,12337,758
EDWARDIAN PARASOL BLACK,16263.220000000001,2801,388
GARDENERS KNEELING PAD KEEP CALM ,16188.15,8711,924
KNITTED UNION FLAG HOT WATER BOTTLE,16106.04,3589,464
HAND OVER THE CHOCOLATE   SIGN ,15848.11,8194,682
STRAWBERRY CERAMIC TRINKET BOX,15820.55,11470,888
VINTAGE CHRISTMAS BUNTING,15768.960000000001,2984,403
RECYCLING BAG RETROSPOT ,15514.34,6846,753
SET/4 WHITE RETRO STORAGE CUBES ,15115.050000000001,380,163
PAPER CHAIN KIT EMPIRE,15002.02,5019,447
 SET 2 TEA TOWELS I LOVE LONDON ,14423.33,4703,544
DOORMAT ENGLISH ROSE ,14276.3,2041,414
HAND WARMER SCOTTY DOG DESIGN,14201.52,6465,558
MEMO BOARD RETROSPOT  DESIGN,14159.4,2953,464
JUMBO STORAGE BAG SKULLS,14024.92,6447,708
WOOD 2 DRAWER CABINET WHITE FINISH,13999.37,2190,586
PAPER CHAIN KIT RETROSPOT,13994.34,4602,615
HAND WARMER BIRD DESIGN,13967.39,6292,562
mailout ,13953.65,7037,602
RED KITCHEN SCALES,13943.65,1612,571
BOX OF VINTAGE ALPHABET BLOCKS,13779.96,1329,272
BREAD BIN DINER STYLE IVORY,13677.539999999999,852,409
DOUGHNUT LIP GLOSS ,13645.77,10355,347
WORLD WAR 2 GLIDERS ASSTD DESIGNS,13587.93,53847,540
PLASTERS IN TIN SPACEBOY,13567.46,8053,681
DOORMAT SPOTTY HOME SWEET HOME,13563.51,1751,483
SET 7 BABUSHKA NESTING BOXES,13501.47,1666,385
JUMBO BAG VINTAGE CHRISTMAS ,13473.27,8110,488
LOVE HOT WATER BOTTLE,13441.42,2377,478
CHRISTMAS LIGHTS 10 REINDEER,13383.67,1621,331
PLASTERS IN TIN WOODLAND ANIMALS,13296.92,7784,709
CLOTHES PEGS RETROSPOT PACK 24 ,13279.46,8647,783
SET 6 SCHOOL MILK BOTTLES IN CRATE,13254.85,2837,410
SET OF 10 LED DOLLY LIGHTS,12985.42,2157,390
3 HOOK PHOTO SHELF ANTIQUE WHITE,12869.76,1858,401
WOODEN UNION JACK BUNTING,12768.45,2087,409
NO SINGING METAL SIGN,12761.98,5521,551
GREY HEART HOT WATER BOTTLE,12701.08,3204,565
LUNCH BAG ALPHABET DESIGN,12700.6,7403,753
RED RETROSPOT MINI CASES,12595.23,1742,389
ASSORTED COLOUR MINI CASES,12550.57,1762,389
LOVE BUILDING BLOCK WORD,12548.91,2030,631
WOODEN ROUNDERS GARDEN SET ,12534.47,1327,362
STRAWBERRY CHARLOTTE BAG,12489.69,9723,734
BLACK HEART CARD HOLDER,12483.220000000001,4870,190
VINTAGE SNAP CARDS,12443.71,14443,929
ENAMEL FLOWER JUG CREAM,12427.16,2042,523
SWEETHEART CAKESTAND 3 TIER,12225.73,1152,576
PACK OF 60 PINK PAISLEY CAKE CASES,12189.47,24753,875
PINK HAPPY BIRTHDAY BUNTING,12077.300000000001,2256,407
DOORMAT WELCOME PUPPIES,12074.92,2060,290
ENAMEL BREAD BIN CREAM,12041.23,847,471
REGENCY SUGAR BOWL GREEN,12005.53,2969,339
3 HEARTS HANGING DECORATION RUSTIC,11873.13,3318,312
SET/3 RED GINGHAM ROSE STORAGE BOX,11784.42,2999,489
RED DINER WALL CLOCK,11689.619999999999,1379,469
PAPER BUNTING WHITE LACE,11669.43,3972,338
GARDENERS KNEELING PAD CUP OF TEA ,11584.09,6675,765
DOORMAT WELCOME TO OUR HOME,11531.710000000001,1526,450
RED RETROSPOT PICNIC BAG,11513.99,3931,543
FAIRY CAKE FLANNEL ASSORTED COLOUR,11477.859999999999,7103,265
RED RETROSPOT ROUND CAKE TINS,11442.84,1080,351
FELTCRAFT CUSHION OWL,11411.32,2916,479
JUMBO BAG PAISLEY PARK,11388.27,4913,342
"SET 3 RETROSPOT TEA,COFFEE,SUGAR",11329.06,2117,440
SET/20 RED RETROSPOT PAPER NAPKINS ,11304.91,13195,988
ALARM CLOCK BAKELIKE IVORY,11284.65,2840,583
RED RETROSPOT UMBRELLA,11283.11,1938,375
"RECORD FRAME 7"" SINGLE SIZE ",11260.81,4336,365
FAWN BLUE HOT WATER BOTTLE,11226.77,3226,497
CHARLOTTE BAG PINK POLKADOT,11218.76,9455,760
FELTCRAFT 6 FLOWER FRIENDS,11215.58,5449,560
WOODEN CROQUET GARDEN SET,11179.21,774,306
LUNCH BAG DOLLY GIRL DESIGN,11062.53,6707,690
PINK BLUE FELT CRAFT TRINKET BOX,11059.33,8384,526
METAL SIGN TAKE IT OR LEAVE IT ,11051.69,3759,415
CLASSIC METAL BIRDCAGE PLANT HOLDER,11040.07,950,297
JUMBO BAG TOYS ,10974.31,4668,532
SOLDIERS EGG CUP ,10805.529999999999,8878,430
GREEN 3 PIECE POLKADOT CUTLERY SET,10762.67,2666,328
HANGING JAM JAR T-LIGHT HOLDER,10753.01,13476,451
BAKING SET SPACEBOY DESIGN,10602.9,-419,481
15CM CHRISTMAS GLASS BALL 20 LIGHTS,10602.66,1318,283
SET OF 6 RIBBONS VINTAGE CHRISTMAS,10534.9,3369,433
VINTAGE HEADS AND TAILS CARD GAME ,10490.65,7854,611
COLOUR GLASS T-LIGHT HOLDER HANGING,10473.4,16380,633
TRADITIONAL WOODEN SKIPPING ROPE,10466.68,8079,433
FELTCRAFT CUSHION RABBIT,10395.12,2788,394
LUNCH BAG VINTAGE LEAF DESIGN,10388.16,6269,672
BLUE HAPPY BIRTHDAY BUNTING,10387.85,1968,393
BLUE HARMONICA IN BOX ,10298.56,7843,605
BREAD BIN DINER STYLE RED ,10259.92,639,296
ANTIQUE SILVER TEA GLASS ENGRAVED,10258.98,8674,357
DOORMAT BLACK FLOCK ,10237.11,1758,199
LONDON BUS COFFEE MUG,10191.15,4351,320
FAMILY ALBUM WHITE PICTURE FRAME,10096.71,1166,389
REGENCY TEA PLATE ROSES ,10070.75,6151,457
VINTAGE DOILY JUMBO BAG RED ,10010.77,4694,262
HAND WARMER UNION JACK,10002.72,4788,487
TRADITIONAL KNITTING NANCY,9992.2,6099,613
EDWARDIAN PARASOL RED,9967.87,1701,329
PLASTERS IN TIN CIRCUS PARADE ,9961.21,6052,581
RED SPOTTY BISCUIT TIN,9951.24,2384,405
ICE CREAM SUNDAE LIP GLOSS,9930.76,8072,279
DOORMAT HOME SWEET HOME BLUE ,9911.300000000001,1617,290
SET OF 6 SOLDIER SKITTLES,9906.29,2566,448
REGENCY TEA PLATE GREEN ,9905.74,6150,386
PLASTERS IN TIN STRONGMAN,9828.63,6002,519
T-LIGHT GLASS FLUTED ANTIQUE,9771.13,7780,356
STRAWBERRY LUNCH BOX WITH CUTLERY,9712.88,3926,585
DELUXE SEWING KIT ,9705.6,1379,342
PHOTO FRAME CORNICE,9687.24,3244,520
TRADITIONAL MODELLING CLAY,9601.26,8167,390
CHRISTMAS CRAFT LITTLE FRIENDS,9588.78,4038,547
SMALL GLASS HEART TRINKET POT,9541.43,4113,581
FELTCRAFT CUSHION BUTTERFLY,9474.95,2487,352
VINTAGE CREAM DOG FOOD CONTAINER,9459.02,978,424
ZINC FOLKART SLEIGH BELLS,9425.36,4780,463
POTTERING IN THE SHED METAL SIGN,9413.82,4175,541
60 CAKE CASES VINTAGE CHRISTMAS,9384.32,15767,623
SET OF 20 KIDS COOKIE CUTTERS,9376.85,4309,520
LADIES & GENTLEMEN METAL SIGN,9376.23,4152,483
REGENCY MILK JUG PINK ,9374.65,3042,342
WOODEN SCHOOL COLOURING SET,9344.82,5612,436
IVORY DINER WALL CLOCK,9317.45,1108,431
PANTRY ROLLING PIN,9296.12,2390,250
FELTCRAFT PRINCESS CHARLOTTE DOLL,9264.91,2375,449
TEA TIME PARTY BUNTING,9248.32,-143,477
NATURAL SLATE CHALKBOARD LARGE ,9227.67,1663,508
GINGERBREAD MAN COOKIE CUTTER,9205.9,7379,674
REVOLVER WOODEN RULER ,9186.439999999999,4520,356
PINK CREAM FELT CRAFT TRINKET BOX ,9129.31,7338,618
60 TEATIME FAIRY CAKE CASES,9088.02,18040,836
RED METAL BOX TOP SECRET,9068.12,1068,264
DOORMAT MULTICOLOUR STRIPE,9064.48,1462,205
BOX OF 6 MINI 50'S CRACKERS,9021.87,3623,409
CLEAR DRAWER KNOB ACRYLIC EDWARDIAN,9012.94,6605,445
SET OF 3 NOTEBOOKS IN PARCEL,9004.34,5207,427
ALARM CLOCK BAKELIKE ORANGE,8964.31,2302,463
HAND WARMER RED LOVE HEART,8941.61,4027,397
HAND WARMER RED POLKA DOT,8936.28,4366,402
SET 2 PANTRY DESIGN TEA TOWELS,8934.27,2791,376
WOODEN BOX OF DOMINOES,8829.79,6377,590
AREA PATROLLED METAL SIGN,8823.09,4218,442
BOX OF 6 MINI VINTAGE CRACKERS,8798.68,3643,383
RED RETROSPOT PEG BAG,8790.8,2919,498
LARGE WHITE HEART OF WICKER,8755.56,2982,573
MULTI COLOUR SILVER T-LIGHT HOLDER,8657.17,10454,366
WOODEN ADVENT CALENDAR RED,8641.32,745,142
TRAVEL SEWING KIT,8595.57,4971,473
STOP FOR TEA WALL ART,8573.2,1381,261
FELTCRAFT DOLL MOLLY,8503.69,3067,336
SWEETHEART RECIPE BOOK STAND,8499.55,1192,372
VINTAGE DOILY TRAVEL SEWING KIT,8498.28,3964,418
ICE CREAM PEN LIP GLOSS ,8493.34,6783,259
SET 6 PAPER TABLE LANTERN HEARTS ,8474.35,2305,303
BICYCLE SAFTEY WALL ART,8464.04,1328,216
SET OF 3 HEART COOKIE CUTTERS,8450.9,6278,689
SMALL WHITE HEART OF WICKER,8408.92,4698,633
PACK OF 72 SKULL CAKE CASES,8392.039999999999,15128,664
CHICK GREY HOT WATER BOTTLE,8387.92,2053,405
CHILDRENS CUTLERY SPACEBOY ,8337.37,2027,376
WHITE METAL LANTERN,8302.05,1911,342
SET OF 72 RETROSPOT PAPER  DOILIES,8200.539999999999,5502,459
GRAND CHOCOLATECANDLE,8188.75,5953,300
HANGING HEART ZINC T-LIGHT HOLDER,8148.7,9118,609
3 TIER CAKE TIN RED AND CREAM,8093.51,556,184
SET OF 3 BUTTERFLY COOKIE CUTTERS,8062.71,5730,696
BLUE DINER WALL CLOCK,8020.99,924,373
SET/2 RED RETROSPOT TEA TOWELS ,7999.849999999999,2403,396
ALARM CLOCK BAKELIKE CHOCOLATE,7981.1,1934,441
PACK OF 12 LONDON TISSUES ,7972.76,26315,515
SET/10 RED POLKADOT PARTY CANDLES,7913.849999999999,6538,382
FAMILY PHOTO FRAME CORNICE,7913.24,832,285
OPEN CLOSED METAL SIGN,7909.08,1635,389
SET OF 20 VINTAGE CHRISTMAS NAPKINS,7855.34,8728,617
FELTCRAFT CHRISTMAS FAIRY,7854.5,1896,326
RECIPE BOX RETROSPOT ,7840.4,2778,486
LUNCH BOX WITH CUTLERY RETROSPOT ,7832.92,3077,491
PAINTED METAL PEARS ASSORTED,7815.11,4428,373
SET OF 4 KNICK KNACK TINS LONDON ,7759.96,1846,282
PLASTERS IN TIN VINTAGE PAISLEY ,7732.54,4694,570
DOORMAT 3 SMILEY CATS,7717.03,1174,235
CHOCOLATE THIS WAY METAL SIGN,7701.82,3747,471
WHITE WOOD GARDEN PLANT LADDER,7686.429999999999,760,446
CANDLEHOLDER PINK HANGING HEART,7680.2,2710,483
ROSE COTTAGE KEEPSAKE BOX ,7673.08,753,202
 SPACEBOY BABY GIFT SET,7657.0,493,187
CHARLOTTE BAG APPLES DESIGN,7603.6,7790,591
DOORMAT UNION JACK GUNS AND ROSES,7597.02,1230,206
FELTCRAFT PRINCESS LOLA DOLL,7540.58,2014,415
FELTCRAFT BUTTERFLY HEARTS,7523.29,5273,490
PACK OF 6 BIRDY GIFT TAGS,7505.389999999999,6188,398
CREAM CUPID HEARTS COAT HANGER,7494.82,1422,293
METAL 4 HOOK HANGER FRENCH CHATEAU,7493.93,2320,502
CHILDRENS APRON SPACEBOY DESIGN,7450.08,3722,563
SWEETHEART CERAMIC TRINKET BOX,7440.45,5906,536
MINT KITCHEN SCALES,7430.18,841,378
RED STRIPE CERAMIC DRAWER KNOB,7424.99,5444,447
ZINC METAL HEART DECORATION,7383.07,5909,537
TOY TIDY PINK POLKADOT,7381.49,3414,476
FUNKY DIVA PEN,7320.509999999999,8496,236
ENGLISH ROSE HOT WATER BOTTLE,7317.95,1611,377
BOX OF 6 CHRISTMAS CAKE DECORATIONS,7292.43,1858,223
YOU'RE CONFUSING ME METAL SIGN ,7291.14,4336,456
SILVER HANGING T-LIGHT HOLDER,7230.09,4538,325
CIRCUS PARADE LUNCH BOX ,7143.0199999999995,3651,402
SET OF 2 WOODEN MARKET CRATES,7113.85,520,212
MEMO BOARD COTTAGE DESIGN,7079.47,1456,316
VINTAGE SNAKES & LADDERS,7062.7,1792,398
SET 10 LIGHTS NIGHT OWL,7054.0,938,295
SET 6 PAPER TABLE LANTERN STARS ,7040.48,1870,249
PLASTERS IN TIN SKULLS,7038.07,4209,568
GIANT 50'S CHRISTMAS CRACKER,7034.59,2655,335
JUMBO BAG DOLLY GIRL DESIGN,7031.83,3409,452
BLUE STRIPE CERAMIC DRAWER KNOB,7020.99,5205,435
KEEP CALM WALL ART ,7019.01,1237,103
VICTORIAN SEWING BOX SMALL ,7014.75,1117,294
DOILEY STORAGE TIN,7010.84,2476,344
VICTORIAN SEWING BOX LARGE,6995.05,452,185
CARRIAGE,6986.0,290,144
PIGGY BANK RETROSPOT ,6985.179999999999,2646,354
SET OF 12 FAIRY CAKE BAKING CASES,6975.43,8454,557
UNION STRIPE WITH FRINGE  HAMMOCK,6952.31,900,209
DOORMAT VINTAGE LEAVES DESIGN ,6945.93,1004,236
SET/6 RED SPOTTY PAPER PLATES,6933.259999999999,8758,527
BEWARE OF THE CAT METAL SIGN ,6918.8,4070,452
RETROSPOT PARTY BAG + STICKER SET,6911.94,4412,329
AGED GLASS SILVER T-LIGHT HOLDER,6876.82,10562,345
BLACK/BLUE POLKADOT UMBRELLA,6874.29,1176,293
PICTURE FRAME WOOD TRIPLE PORTRAIT,6858.95,1049,270
HEART FILIGREE DOVE  SMALL,6858.83,5500,302
CHILDRENS CUTLERY DOLLY GIRL ,6849.16,1690,307
HAND WARMER BABUSHKA DESIGN,6830.179999999999,4767,375
JINGLE BELL HEART ANTIQUE SILVER,6829.84,3447,211
TRIPLE PHOTO FRAME CORNICE ,6825.3,739,235
VICTORIAN SEWING BOX MEDIUM,6820.97,590,268
SINGLE HEART ZINC T-LIGHT HOLDER,6820.35,6254,508
FULL ENGLISH BREAKFAST PLATE,6814.26,1610,302
BELL HEART DECORATION,6813.16,4052,368
WOODEN ADVENT CALENDAR CREAM,6809.42,416,145
CHILDS BREAKFAST SET SPACEBOY ,6809.3,725,245
WALL ART CLASSIC PUDDINGS ,6807.41,890,154
3 TIER CAKE TIN GREEN AND CREAM,6802.2699999999995,433,211
4 TRADITIONAL SPINNING TOPS,6776.5599999999995,4885,486
ROUND CAKE TIN VINTAGE RED,6769.64,896,286
SET 40 HEART SHAPE PETIT FOUR CASES,6749.33,4277,165
RAIN PONCHO RETROSPOT,6743.65,8350,246
WHITE SPOT RED CERAMIC DRAWER KNOB,6738.349999999999,4963,416
PINK FAIRY CAKE CHILDRENS APRON,6728.59,3142,498
36 DOILIES VINTAGE CHRISTMAS,6719.349999999999,4885,189
VINTAGE DONKEY TAIL GAME ,6698.82,1858,261
MINI LIGHTS WOODLAND MUSHROOMS,6658.54,1781,217
SET OF 72 PINK HEART PAPER DOILIES,6653.849999999999,7299,513
LED TEA LIGHTS,6639.33,2305,269
DOLLY GIRL BABY GIFT SET,6634.86,428,137
VINYL RECORD FRAME SILVER,6634.8,1697,158
LARGE CIRCULAR MIRROR MOBILE,6623.78,6886,225
CHRISTMAS LIGHTS 10 VINTAGE BAUBLES,6619.67,1318,223
BINGO SET,6610.79,1622,387
BISCUIT TIN 50'S CHRISTMAS,6597.39,2160,314
RED RETROSPOT SHOPPER BAG,6570.05,4741,580
PINK BABY BUNTING,6553.42,2130,348
RETROSPOT LARGE MILK JUG,6553.32,1329,350
ADVENT CALENDAR GINGHAM SACK,6545.14,1256,251
72 SWEETHEART FAIRY CAKE CASES,6493.19,13230,619
DOORSTOP RETROSPOT HEART,6462.13,1577,300
LANDMARK FRAME CAMDEN TOWN ,6457.15,569,68
VINTAGE CHRISTMAS STOCKING ,6449.95,2375,348
CHRISTMAS CRAFT TREE TOP ANGEL,6440.69,2780,461
TRADITIONAL NAUGHTS & CROSSES,6436.610000000001,2859,257
SET/10 PINK POLKADOT PARTY CANDLES,6434.79,5282,347
LARGE ZINC HEART WALL ORGANISER,6431.110000000001,1173,40
VINTAGE  2 METER FOLDING RULER,6427.97,3459,336
GIRAFFE WOODEN RULER,6422.889999999999,3175,280
RED RETROSPOT BOWL,6413.5599999999995,5054,451
VINTAGE RED KITCHEN CABINET,6394.5,39,47
SET OF 2 TEA TOWELS APPLE AND PEARS,6332.25,2057,285
SET OF 60 PANTRY DESIGN CAKE CASES ,6331.19,11975,634
WOODEN HAPPY BIRTHDAY GARLAND,6313.41,2167,291
SUKI  SHOULDER BAG,6296.96,3392,531
CLASSIC GLASS SWEET JAR,6291.99,1236,350
PANTRY WASHING UP BRUSH,6284.42,4006,386
RED FLORAL FELTCRAFT SHOULDER BAG,6256.86,1673,307
REGENCY TEA PLATE PINK,6206.61,3769,314
LANTERN CREAM GAZEBO ,6204.69,1201,328
COFFEE MUG APPLES DESIGN,6182.4,2748,271
BUNDLE OF 3 ALPHABET EXERCISE BOOKS,6137.34,3530,347
RED RETROSPOT OVEN GLOVE ,6094.76,3823,455
PACK OF 60 DINOSAUR CAKE CASES,6081.849999999999,12269,604
BLUE SPOT CERAMIC DRAWER KNOB,6045.04,4188,383
RETROSPOT CHILDRENS APRON,6017.0,3132,366
PHOTO CUBE,6013.43,3239,321
PLACE SETTING WHITE HEART,6010.33,14260,337
VINTAGE CHRISTMAS GIFT SACK,5964.150000000001,1423,215
SET 3 WICKER OVAL BASKETS W LIDS,5961.25,465,34
SET OF 6 TEA TIME BAKING CASES,5954.3,4954,384
RECYCLED ACAPULCO MAT TURQUOISE,5941.09,653,279
SAVE THE PLANET MUG,5940.27,4769,369
WHITE SPOT BLUE CERAMIC DRAWER KNOB,5927.8,4279,375
DOG LICENCE WALL ART,5926.2,996,145
PARISIENNE JEWELLERY DRAWER ,5922.18,763,278
PACK OF 6 PANNETONE GIFT BOXES,5916.36,2318,198
3 STRIPEY MICE FELTCRAFT,5903.94,3019,472
RED SPOT CERAMIC DRAWER KNOB,5863.73,4269,383
BROCADE RING PURSE ,5863.59,23053,242
DOORMAT TOPIARY,5850.69,881,209
DOORMAT AIRMAIL ,5840.83,776,226
QUEENS GUARD COFFEE MUG,5811.64,2415,277
HOME SWEET HOME MUG,5808.01,4366,364
FELTCRAFT PRINCESS OLIVIA DOLL,5805.22,1564,291
POLKADOT PEN,5793.62,5835,173
SET OF 4 JAM JAR MAGNETS,5780.4800000000005,2671,238
DOORMAT RESPECTABLE HOUSE,5746.38,791,183
SOMBRERO ,5716.85,4415,61
WOODEN OWLS LIGHT GARLAND ,5696.35,1515,155
CHILDS BREAKFAST SET DOLLY GIRL ,5695.23,598,201
LOVE SEAT ANTIQUE WHITE METAL,5692.5,54,45
CERAMIC STRAWBERRY CAKE MONEY BANK,5653.87,4139,401
RED RETROSPOT PLATE ,5645.63,3341,308
PACK OF 20 NAPKINS PANTRY DESIGN,5637.7,6535,676
CHRISTMAS GINGHAM HEART,5627.58,6577,469
CHARLOTTE BAG VINTAGE ALPHABET ,5587.83,5668,475
FAIRY TALE COTTAGE NIGHTLIGHT,5571.889999999999,3049,212
WALL ART BIG LOVE ,5559.11,979,112
SKULL LUNCH BOX WITH CUTLERY ,5557.87,2134,416
FRYING PAN UNION FLAG,5555.59,1259,212
NATURAL SLATE RECTANGLE CHALKBOARD,5517.58,3161,424
LARGE IVORY HEART WALL ORGANISER,5517.15,781,156
PAPER BUNTING COLOURED LACE,5511.85,1799,243
HOT WATER BOTTLE BABUSHKA ,5504.93,1048,186
LUNCH BAG PAISLEY PARK  ,5497.33,3385,326
TREASURE ISLAND BOOK BOX,5483.04,2515,272
DOLLCRAFT GIRL AMELIE KIT,5477.59,1098,297
CALENDAR PAPER CUT DESIGN,5473.16,1836,272
HEART IVORY TRELLIS SMALL,5468.66,4171,378
3 PIECE SPACEBOY COOKIE CUTTER SET,5451.69,2614,385
10 COLOUR SPACEBOY PEN,5439.25,6392,326
BOTANICAL GARDENS WALL CLOCK ,5436.52,244,96
ANTIQUE GLASS DRESSING TABLE POT,5431.5,1754,284
SMALL ZINC HEART WALL ORGANISER,5416.18,1642,48
ENAMEL MEASURING JUG CREAM,5409.43,1239,392
SET OF 5 LUCKY CAT MAGNETS ,5393.1900000000005,2575,258
DOG BOWL CHASING BALL DESIGN,5340.2699999999995,1355,133
HANGING METAL HEART LANTERN,5332.52,3305,363
PARTY METAL SIGN ,5327.03,3388,472
VINTAGE CREAM CAT FOOD CONTAINER,5315.18,789,325
PHOTO FRAME 3 CLASSIC HANGING,5283.3,169,255
HEART IVORY TRELLIS LARGE,5272.47,3155,319
TRAVEL CARD WALLET KEEP CALM,5240.56,12313,545
PINK DRAWER KNOB ACRYLIC EDWARDIAN,5207.95,3866,256
SMALL IVORY HEART WALL ORGANISER,5196.1,1030,155
CHILDRENS APRON APPLES DESIGN,5174.32,2426,365
BOX OF VINTAGE JIGSAW BLOCKS ,5163.01,924,241
WELCOME  WOODEN BLOCK LETTERS,5157.54,514,190
HOME SWEET HOME METAL SIGN ,5144.18,1762,283
REGENCY TEA STRAINER,5143.69,1412,176
RECIPE BOX BLUE SKETCHBOOK DESIGN,5132.93,1478,371
SET OF 3 WOODEN HEART DECORATIONS,5125.94,3846,450
RED RETROSPOT MUG,5112.04,1828,167
COFFEE MUG PEARS  DESIGN,5106.24,2318,215
BATH BUILDING BLOCK WORD,5077.66,821,271
SET OF 12 MINI LOAF BAKING CASES,5067.64,6127,449
CHRISTMAS TOILET ROLL,5051.85,3459,254
BREAD BIN DINER STYLE PINK,5048.95,300,139
BISCUIT TIN VINTAGE CHRISTMAS,5042.21,1925,283
FOOT STOOL HOME SWEET HOME ,5037.95,474,223
AIRLINE BAG VINTAGE TOKYO 78,5035.79,1086,405
SET3 BOOK BOX GREEN GINGHAM FLOWER ,5031.63,1173,268
I'M ON HOLIDAY METAL SIGN,5004.08,2283,370
RUSTIC  SEVENTEEN DRAWER SIDEBOARD,5000.0,28,31
FELTCRAFT DOLL ROSIE,4998.5,1655,304
BUBBLEGUM RING ASSORTED,4997.28,12050,245
LARGE CERAMIC TOP STORAGE JAR,4993.16,3016,298
VINTAGE DOILY DELUXE SEWING KIT ,4991.06,748,216
PANTRY MAGNETIC  SHOPPING LIST,4975.599999999999,3282,489
VINTAGE CHRISTMAS TABLECLOTH,4975.46,404,119
COFFEE MUG CAT + BIRD DESIGN,4972.43,2204,266
LANDMARK FRAME COVENT GARDEN ,4962.01,438,54
SET 3 PAPER VINTAGE CHICK PAPER EGG,4951.6,1752,218
SCANDINAVIAN PAISLEY PICNIC BAG,4946.63,2691,449
TRADITIONAL PICK UP STICKS GAME ,4944.37,2782,276
LIGHT GARLAND BUTTERFILES PINK,4938.09,1321,140
"ASSORTED FLOWER COLOUR ""LEIS""",4934.87,10315,111
CHRISTMAS CRAFT WHITE FAIRY ,4934.59,3183,381
PINK VINTAGE PAISLEY PICNIC BAG,4929.58,2663,414
BIRD HOUSE HOT WATER BOTTLE,4909.59,1171,280
POPPY'S PLAYHOUSE KITCHEN,4861.93,2108,440
SET/6 RED SPOTTY PAPER CUPS,4861.9,7137,428
PLAYING CARDS KEEP CALM & CARRY ON,4861.8,3644,337
STRAWBERRY   PICNIC BAG,4854.6,1593,260
JUMBO BAG CHARLIE AND LOLA TOYS,4852.02,1515,307
FILIGRIS HEART WITH BUTTERFLY,4848.13,3903,213
GUMBALL MAGAZINE RACK,4846.31,573,245
CIRCUS PARADE BABY GIFT SET,4845.7,313,113
LANDMARK FRAME OXFORD STREET,4830.53,424,57
BREAD BIN DINER STYLE MINT,4827.38,310,137
DOORMAT MERRY CHRISTMAS RED ,4822.25,668,151
LANDMARK FRAME NOTTING HILL ,4818.07,424,50
SET/10 BLUE POLKADOT PARTY CANDLES,4806.8,3966,243
PICTURE DOMINOES,4799.83,3189,356
ROLL WRAP 50'S CHRISTMAS,4775.7699999999995,3443,357
POTTERING MUG,4775.61,3754,341
SPACEBOY MINI BACKPACK,4772.24,1120,238
CHILDS BREAKFAST SET CIRCUS PARADE,4769.86,567,212
PINK POLKADOT BOWL,4743.59,3671,334
TRADTIONAL ALPHABET STAMP SET,4742.41,959,193
LANDMARK FRAME LONDON BRIDGE ,4741.37,418,52
PINK HEART SHAPE EGG FRYING PAN,4739.08,2924,261
5 HOOK HANGER RED MAGIC TOADSTOOL,4735.14,3088,134
SET OF 6 NATIVITY MAGNETS ,4726.1,2782,166
EDWARDIAN PARASOL PINK,4721.1,801,174
SET OF 5 PANCAKE DAY MAGNETS,4719.76,2197,227
BLUE VINTAGE SPOT BEAKER,4705.97,4999,225
BULL DOG BOTTLE OPENER,4700.15,861,268
CERAMIC HEART FAIRY CAKE MONEY BANK,4697.28,2347,356
TREASURE TIN GYMKHANA DESIGN,4694.51,2177,368
RIBBON REEL STRIPES DESIGN ,4683.33,2693,411
WASHROOM METAL SIGN,4680.63,3016,364
CERAMIC CAKE STAND + HANGING CAKES,4680.54,514,179
SET OF 3 CAKE TINS SKETCHBOOK,4678.71,1022,297
POPPY'S PLAYHOUSE BEDROOM ,4651.29,2016,426
RED RETROSPOT BUTTER DISH,4649.8,845,257
TRADITIONAL CHRISTMAS RIBBONS,4645.2,3237,360
PACK 3 BOXES BIRD PANNETONE ,4640.78,2372,218
PINK PARTY BAGS,4636.9,2450,166
HEART FILIGREE DOVE LARGE,4623.87,2795,251
ABC TREASURE BOOK BOX ,4596.33,2122,236
PURPLE DRAWERKNOB ACRYLIC EDWARDIAN,4586.87,3159,240
PINK VINTAGE SPOT BEAKER,4570.71,4805,192
WOODEN SKITTLES GARDEN SET,4552.11,265,154
CAMOUFLAGE LED TORCH,4543.7300000000005,2586,172
CABIN BAG VINTAGE RETROSPOT,4542.07,242,72
PACK OF 60 SPACEBOY CAKE CASES,4541.24,8380,522
LAUNDRY 15C METAL SIGN,4537.69,2804,355
36 PENCILS TUBE RED RETROSPOT,4529.9800000000005,3579,341
PICNIC BOXES SET OF 3 RETROSPOT ,4521.91,945,201
CLASSIC SUGAR DISPENSER,4494.3099999999995,3238,355
SET OF 60 I LOVE LONDON CAKE CASES ,4478.8,8244,411
WALL ART ONLY ONE PERSON ,4465.97,1062,87
SKULL SHOULDER BAG,4463.78,2411,412
SET OF 3 HANGING OWLS OLLIE BEAK,4462.56,3672,329
PAPER BUNTING VINTAGE PAISLEY,4460.38,1448,273
SET OF 36 TEATIME PAPER DOILIES,4452.32,3038,337
GREEN VINTAGE SPOT BEAKER,4429.0599999999995,4544,190
HOME SWEET HOME BLACKBOARD,4418.21,1023,184
REGENCY SUGAR TONGS,4400.820000000001,1777,211
CUPCAKE LACE PAPER SET 6,4371.63,2307,190
