product_name,product_revenue,units_sold,order_count
FRENCH BLUE METAL DOOR SIGN 7,883.0,678,121
SUNFLOWER DECORATIVE PARASOL,882.71,124,43
FIVE CATS HANGING DECORATION,882.62,287,89
BIRD DECORATION RED RETROSPOT,880.4799999999999,916,133
WIRE EGG BASKET ,880.23,114,44
PINK DOG BOWL,879.89,533,120
SEWING SUSAN 21 NEEDLE SET,879.62,917,173
VINTAGE COFFEE GRINDER BOX,879.31,165,59
MULTICOLOUR HONEYCOMB FAN,877.91,1205,94
TEA COSY BLUE STRIPE,877.38,250,105
SMALL SILVER FLOWER CANDLE POT,875.38,290,41
FELTCRAFT HAIRBANDS PINK AND WHITE ,873.52,934,148
ROSE 1 WICK MORRIS BOXED CANDLE,872.61,-999,89
FRENCH CARRIAGE LANTERN,872.15,129,62
FAIRY CAKES NOTEBOOK A7 SIZE,872.03,2059,181
BIRDHOUSE DECORATION MAGIC GARDEN,871.99,698,140
TRAVEL CARD WALLET SKULLS,871.53,2017,200
URBAN BLACK RIBBONS ,870.35,849,184
DAISIES  HONEYCOMB GARLAND ,868.44,499,85
PINK  HEART CONFETTI IN TUBE,868.17,918,79
STAR PORTABLE TABLE LIGHT ,864.05,211,52
FOLDING UMBRELLA CREAM POLKADOT,863.11,190,65
REINDEER HEART DECORATION GOLD,860.0200000000001,982,104
PARTY PIZZA DISH RED RETROSPOT,858.6,1959,95
PANTRY 3 HOOK ROLLING PIN HANGER,858.15,214,69
FRENCH BLUE METAL DOOR SIGN 8,856.49,651,129
PAINTED METAL HEART WITH HOLLY BELL,854.74,1283,100
RELAX LARGE WOOD LETTERS,852.3299999999999,99,33
CHEST 7 DRAWER MA CAMPAGNE,851.48,34,27
RED RETROSPOT TAPE,850.98,1891,241
CHARLIE & LOLA WASTEPAPER BIN BLUE,849.54,665,88
MAGIC TREE -PAPER FLOWERS,848.6999999999999,918,106
RED DRAGONFLY HELICOPTER,848.4300000000001,92,70
LOVE HEART NAPKIN BOX ,843.95,142,67
SET OF 4 FAIRY CAKE PLACEMATS,843.34,222,83
WHITE BAMBOO RIBS LAMPSHADE,842.3,706,73
BLACK PIRATE TREASURE CHEST,841.93,518,145
EGG CUP MILKMAID INGRID,841.31,644,76
PACK OF 12 PAISLEY PARK TISSUES ,841.01,1843,136
FRENCH PAISLEY CUSHION COVER ,840.4399999999999,495,106
SMALL REGAL  SILVER CANDLEPOT ,840.33,307,24
ASSTD MULTICOLOUR CIRCLES MUG,838.91,1355,87
WRAP COWBOYS  ,837.44,2032,72
FELT TOADSTOOL LARGE,836.8000000000001,657,61
BLUE CALCULATOR RULER,833.49,657,113
FELTCRAFT HAIRBAND RED AND BLUE,833.0699999999999,880,162
SET 6 FOOTBALL CELEBRATION CANDLES,832.23,658,105
BLUE POLKADOT COFFEE MUG,831.0,1839,75
WHITE CHRISTMAS GARLAND STARS TREES,830.03,235,70
TRAVEL CARD WALLET PANTRY,829.66,1827,225
PINK STITCHED WALL CLOCK,828.24,659,63
LOVE GARLAND PAINTED ZINC ,827.63,453,78
ETCHED GLASS COASTER,825.49,1483,74
SET OF 4 POLKADOT PLACEMATS ,824.91,174,78
MAGIC DRAWING SLATE DINOSAUR,824.68,1883,172
MORE BUTTER METAL SIGN ,823.71,761,160
DECORATION WHITE CHICK MAGIC GARDEN,823.06,940,146
HOT BATHS SOAP HOLDER,821.82,493,118
MARIE ANTOIENETT TRINKET BOX GOLD,821.1,178,24
WASH BAG VINTAGE ROSE PAISLEY,821.01,224,88
SMALL POLKADOT CHOCOLATE GIFT BAG ,819.64,943,52
APOTHECARY MEASURING JAR,813.78,66,23
FRENCH STYLE STORAGE JAR CAFE ,810.2199999999999,1970,72
MOTORING TISSUE BOX,809.0799999999999,1823,161
HEART GARLAND RUSTIC PADDED,808.79,151,96
WHITE STITCHED WALL CLOCK,808.75,837,49
MEASURING TAPE BABUSHKA RED,804.22,262,43
MINI JIGSAW PURDEY,799.98,2103,87
HANGING SPRING FLOWER EGG LARGE,799.9399999999999,920,76
IVORY LOVE BIRD CANDLE,798.02,800,89
CHRISTMAS DECOUPAGE CANDLE,796.06,1733,81
EASTER DECORATION SITTING BUNNY,795.78,1875,162
FELTCRAFT HAIRBAND PINK AND PURPLE,794.88,879,150
TOXIC AREA  DOOR HANGER ,794.15,1465,162
CARAVAN SQUARE TISSUE BOX,793.4,1437,154
CAT AND BIRD WALL ART,793.37,413,44
EMBROIDERED RIBBON REEL CLAIRE,792.31,224,24
WRAP GREEN PEARS ,790.86,1883,78
KIDS RAIN MAC PINK,789.1999999999999,908,94
SET/6 PINK BIRD T-LIGHT CANDLES,788.99,446,102
SKULLS GREETING CARD,788.97,1835,116
FAIRY CAKES NOTEBOOK A6 SIZE,788.45,1253,158
GARDENIA 3 WICK MORRIS BOXED CANDLE,786.49,216,87
WOODLAND  STICKERS,786.31,868,103
EGG CUP HENRIETTA HEN CREAM ,786.27,629,49
HEART SHAPE WIRELESS DOORBELL,785.33,439,52
ASSORTED TUTTI FRUTTI PEN,784.48,2216,108
CHILDS GARDEN BRUSH BLUE,783.54,336,84
T-LIGHT HOLDER HANGING LACE,782.51,645,84
SET/6 FROG PRINCE T-LIGHT CANDLES,782.27,474,87
SALLE DE BAIN HOOK,781.3199999999999,357,108
ZINC HEARTS PLANT POT HOLDER,780.9100000000001,279,54
SILK PURSE BABUSHKA RED,779.1500000000001,209,57
ROMANTIC IMAGES GIFT WRAP SET,777.14,790,135
BUNNY WOODEN PAINTED WITH BIRD ,776.93,999,148
TOOTHPASTE TUBE PEN,776.75,1274,205
PHOTO FRAME LINEN AND LACE LARGE,775.43,208,45
NOEL GARLAND PAINTED ZINC ,774.88,1399,129
GARDENIA 1 WICK MORRIS BOXED CANDLE,774.68,142,63
CARROT CHARLIE+LOLA COASTER SET,774.55,472,126
MOODY GIRL DOOR HANGER ,774.4599999999999,1450,171
CINAMMON SET OF 9 T-LIGHTS,773.15,860,155
BLACK BAROQUE WALL CLOCK ,770.93,83,37
4 WILDFLOWER BOTANICAL CANDLES,770.87,350,93
PINK LOVE HEART SHAPE CUP,770.73,816,133
PACK OF 12 BLUE PAISLEY TISSUES ,770.71,2277,156
SMALL ROUND CUT GLASS CANDLESTICK,770.29,102,35
SET/6 COLLAGE PAPER CUPS,768.5799999999999,2586,182
FRENCH BLUE METAL DOOR SIGN 0,768.3,593,105
EGG FRYING PAN IVORY ,767.9,366,98
CUSHION COVER PINK UNION JACK,764.63,123,47
FRENCH FLORAL CUSHION COVER ,764.59,632,85
CHILDS GARDEN FORK BLUE ,764.09,795,131
FOLDING UMBRELLA BLACKBLUE POLKADOT,763.6600000000001,160,74
WRAP ALPHABET POSTER  ,763.1,1855,64
BIRDCAGE DECORATION TEALIGHT HOLDER,762.8199999999999,644,68
MINI PAINTED GARDEN DECORATION ,761.4,2476,79
RING OF ROSES BIRTHDAY CARD,761.0500000000001,1805,132
BEADED CRYSTAL HEART GREEN LARGE,760.4300000000001,834,62
ASSORTED INCENSE PACK,760.3199999999999,4032,27
SCENTED VELVET LOUNGE CANDLE ,760.15,1790,55
INFLATABLE POLITICAL GLOBE ,759.89,1037,73
SMALL YELLOW BABUSHKA NOTEBOOK ,758.98,1011,217
FOLDING BUTTERFLY MIRROR IVORY ,757.86,812,135
RED TEA TOWEL CLASSIC DESIGN,757.21,607,74
COCKTAIL SWORDS 50 PIECES,755.4200000000001,930,97
GLITTER CHRISTMAS TREE WITH BELLS,754.75,737,99
PACK OF 12 STICKY BUNNIES,754.53,996,168
MINT GREEN ROSE TOWEL,754.07,196,86
TALL ROCOCO CANDLE HOLDER,753.59,62,22
18PC WOODEN CUTLERY SET DISPOSABLE,751.38,567,43
KENSINGTON COFFEE SET,751.17,109,36
SET OF 6 GIRLS CELEBRATION CANDLES,750.2,593,126
BLACK STITCHED WALL CLOCK,749.94,711,42
RUSTIC STRAWBERRY JAMPOT LARGE ,748.53,364,46
ZINC FINISH 15CM PLANTER POTS,748.34,446,59
DRAWER KNOB VINTAGE GLASS BALL,748.32,344,55
BLACK TEA TOWEL CLASSIC DESIGN,748.08,539,129
BLOSSOM IMAGES GIFT WRAP SET,747.79,798,133
SMALL BONNE JAM JAR  T-LIGHT HOLDER,745.76,392,24
SET OF 3 MINI HANGING PORTRAITS,745.6500000000001,177,53
IVORY PAPER CUP CAKE CASES ,745.4499999999999,1089,124
200 BENDY SKULL STRAWS,742.37,660,56
GOLD MINI TAPE MEASURE ,742.0600000000001,936,206
CHRISTMAS TREE HANGING SILVER ,741.89,791,89
MIRROR MOSAIC HURRICANE LAMP ,741.63,228,49
CHILDS GARDEN FORK PINK,741.4599999999999,764,138
DOVE DECORATION PAINTED ZINC ,739.46,2175,82
FELT FARM ANIMAL WHITE BUNNY ,738.68,1563,96
BIRD DECORATION GREEN POLKADOT,737.61,808,140
"TUMBLER, NEW ENGLAND",735.8299999999999,980,69
SWALLOW SQUARE TISSUE BOX,735.67,1600,146
FELT FARM ANIMAL RABBIT,735.14,905,79
3 RAFFIA RIBBONS VINTAGE CHRISTMAS,734.7900000000001,827,99
SET OF 2 ROUND TINS CAMEMBERT ,734.07,277,99
FELTCRAFT HAIRBAND PINK AND BLUE,733.75,778,164
TRAVEL CARD WALLET FLOWER MEADOW,732.51,1686,178
TEATIME FUNKY FLOWER BACKPACK FOR 2,732.2299999999999,53,57
PAPERWEIGHT VINTAGE COLLAGE,731.78,508,73
PAPER POCKET TRAVELING FAN ,731.73,5206,142
MAGNETS PACK OF 4 HOME SWEET HOME,731.43,1399,151
SET OF 6 RIBBONS PERFECTLY PRETTY  ,730.37,253,43
RED POLKADOT COFFEE  MUG,729.5999999999999,1523,64
PINK SWEETHEART BRACELET,729.57,176,78
DECORATION  BUTTERFLY  MAGIC GARDEN,729.25,817,148
ASSORTED TUTTI FRUTTI MIRROR,728.31,529,62
HEARTS  STICKERS,727.64,823,120
JAZZ HEARTS ADDRESS BOOK,727.4599999999999,3194,225
DOG AND BALL WALL ART,727.4399999999999,354,32
MIRROR MOSAIC T-LIGHT HOLDER ROUND,726.38,778,29
BEADED CRYSTAL HEART PINK ON STICK,725.26,850,206
STARS GIFT TAPE ,725.23,1652,134
GIFT BAG PSYCHEDELIC APPLES,722.67,1171,140
ROSE SCENT CANDLE JEWELLED DRAWER,722.47,486,45
BLUE/CREAM STRIPE CUSHION COVER ,722.4,592,108
DAIRY MAID TOASTRACK,721.38,716,112
SUNSET COLOUR CHUNKY KNITTED THROW,720.93,51,42
CORONA MEXICAN TRAY,719.69,22,40
CARD CAT AND TREE ,717.23,1633,170
DOG TOY WITH PINK CROCHET SKIRT,717.21,146,92
TRIPLE WIRE HOOK IVORY HEART,716.3,170,53
"DECORATION , WOBBLY CHICKEN, METAL ",715.48,784,81
DECORATIVE FLORE BATHROOM BOTTLE,713.11,512,140
FRENCH BLUE METAL DOOR SIGN 9,712.32,530,106
BANQUET BIRTHDAY  CARD  ,712.08,1644,161
CURIOUS IMAGES GIFT WRAP SET,712.04,673,141
RUSTIC STRAWBERRY JAMPOT SMALL,711.24,444,38
IVORY CHANDELIER T-LIGHT HOLDER,710.71,-172,44
MADRAS NOTEBOOK MEDIUM,709.66,897,74
EDWARDIAN HEART PHOTO FRAME,709.5400000000001,160,44
PINK HAWAIIAN PICNIC HAMPER FOR 2,709.24,78,55
FLOOR CUSHION ELEPHANT CARNIVAL,709.1899999999999,68,36
COSY SLIPPER SHOES SMALL GREEN,708.98,256,111
FRYING PAN BLUE POLKADOT,708.3,192,90
RETRO MOD TRAY,706.91,788,159
CHILDS GARDEN SPADE BLUE,706.55,309,104
SWEET HEART CAKE CARRIER,706.03,71,50
ANTIQUE GLASS HEART DECORATION ,705.28,309,41
TOAST ITS - FAIRY FLOWER,704.55,643,151
SILVER T-LIGHT SETTING,704.14,74,30
ASSORTED EASTER DECORATIONS  BELLS,703.3199999999999,518,30
RECYCLED PENCIL WITH RABBIT ERASER,702.75,3103,169
CREAM SLICE FLANNEL CHOCOLATE SPOT ,702.51,237,53
BRIGHT BLUES RIBBONS ,702.41,425,114
"BLACK TEA,COFFEE,SUGAR JARS",700.9499999999999,413,53
STEEL SWEETHEART ROUND TABLE CREAM,699.63,41,24
CHRISTMAS TREE HANGING GOLD,698.61,775,77
BAKING MOULD ROSE WHITE CHOCOLATE,697.97,207,51
PANTRY APPLE CORER,696.88,466,107
SCANDINAVIAN 3 HEARTS NAPKIN RING,696.8,1092,125
SILVER JEWELLED MIRROR TRINKET TRAY,695.23,95,45
BLACK WINE GLASS,695.01,195,25
RATTLE SNAKE EGGS,691.85,815,102
CANDY HEART HANGING DECORATION,690.13,1275,64
BLUE POLKADOT KIDS BAG,688.3,286,74
ASSORTED TUTTI FRUTTI BRACELET,688.29,2526,133
SQUARE FLOOR CUSHION VINTAGE RED,687.95,73,42
DOLLY CABINET 3 DRAWERS ,687.6999999999999,46,34
VINTAGE KEEPSAKE BOX PARIS DAYS,686.86,109,57
GLASS SPHERE CANDLE STAND MEDIUM,684.58,111,35
WOVEN BERRIES CUSHION COVER ,683.8,162,89
LARGE STRIPES CHOCOLATE GIFT BAG,683.75,547,51
DO NOT TOUCH MY STUFF DOOR HANGER ,683.37,1130,129
RED CHARLIE+LOLA PERSONAL DOORSIGN,683.01,1299,126
BLOSSOM  IMAGES NOTEBOOK SET,682.97,527,37
PASTEL COLOUR HONEYCOMB FAN,681.78,904,88
HAND OPEN SHAPE GOLD,681.59,199,30
VINTAGE RED MUG,679.72,691,55
LOVE HEART SOCK HANGER,679.48,355,86
FRENCH STYLE STORAGE JAR BONBONS,678.57,2239,79
RETRO PLASTIC ELEPHANT TRAY,678.23,947,78
SET OF 6 T-LIGHTS WEDDING CAKE ,677.04,260,38
CERAMIC BOWL WITH LOVE HEART DESIGN,677.03,655,78
MAGNETS PACK OF 4 VINTAGE LABELS ,674.67,1311,127
WHITE TRAVEL ALARM CLOCK,673.72,298,91
EASTER DECORATION EGG BUNNY ,673.17,836,83
WOVEN BUBBLE GUM CUSHION COVER,672.6,160,71
GREEN GOOSE FEATHER CHRISTMAS TREE ,672.09,187,45
SET/4 COLOURFUL MIXING BOWLS,671.93,71,43
PINK BUTTERFLY HANDBAG W BOBBLES,671.62,162,98
MR ROBOT SOFT TOY,669.9,212,45
PAPER BUNTING PAISLEY PARK,667.27,245,32
CHRISTMAS TREE PAINTED ZINC ,666.38,2377,86
PACK OF 6 SMALL FRUIT STRAWS,665.1700000000001,1644,102
ENGLISH ROSE SCENTED HANGING FLOWER,664.45,486,116
BLUE PAISLEY JOURNAL ,663.71,253,79
LARGE BONNE JAM JAR  T-LIGHT HOLDER,662.87,253,12
S/12 VANILLA  BOTANICAL T-LIGHTS,661.93,180,43
WRAP FLOWER SHOP  ,661.5,1575,62
PEARLISED IVORY HEART LARGE ,661.02,418,39
IVORY RETRO KITCHEN WALL CLOCK,659.61,75,34
SILK PURSE BABUSHKA BLUE,657.76,194,59
LARGE YELLOW BABUSHKA NOTEBOOK ,656.52,599,123
PIN CUSHION BABUSHKA RED,656.4300000000001,201,45
PACK OF 12 CIRCUS PARADE TISSUES ,656.05,2063,103
LARGE HANGING IVORY & RED WOOD BIRD,654.98,714,98
WHITE BELL HONEYCOMB PAPER GARLAND ,651.75,274,49
MAGIC DRAWING SLATE BUNNIES ,650.85,1718,135
MILK PAN BLUE POLKADOT,650.79,192,81
CHILDRENS GARDEN GLOVES PINK,648.97,431,77
BIRTHDAY PARTY CORDON BARRIER TAPE,647.11,502,98
CARD WEDDING DAY,645.64,1543,130
PAPER LANTERN 7 POINT SNOW STAR,645.01,93,29
ENCHANTED BIRD PLANT CAGE,644.47,186,50
BASKET OF FLOWERS SEWING KIT,644.2099999999999,812,64
ASSORTED TUTTI FRUTTI  FOB NOTEBOOK,644.03,662,78
NAMASTE SWAGAT INCENSE,643.14,2427,47
"CHRISTMAS GARLAND STARS,TREES",641.58,186,49
ENAMEL PINK COFFEE CONTAINER,640.9200000000001,556,76
12 RED ROSE PEG PLACE SETTINGS,640.92,407,106
RED RETROSPOT LUGGAGE TAG,638.36,344,107
CHERUB HEART DECORATION GOLD,637.4,724,73
MAGIC DRAWING SLATE BAKE A CAKE ,636.41,1743,91
CHOC TRUFFLE GOLD TRINKET POT ,636.12,406,73
VINTAGE JINGLE BELLS WREATH,635.38,76,28
NURSE'S BAG SOFT TOY,634.53,41,31
PINK/PURPLE RETRO RADIO,634.0699999999999,222,53
DANISH ROSE DECORATIVE PLATE,632.9399999999999,914,61
BISCUITS SMALL BOWL LIGHT BLUE,632.26,1235,174
OVAL  MINI PORTRAIT FRAME,631.5799999999999,324,47
LAUREL HEART ANTIQUE GOLD,630.73,525,44
SMALL SKULL WINDMILL,630.61,473,55
FENG SHUI PILLAR CANDLE,630.23,3317,65
SMALL APOTHECARY MEASURING JAR ,629.05,81,28
DRAWER KNOB VINTAGE GLASS HEXAGON,627.95,295,30
COCKLE SHELL DISH,627.7,339,69
SIX DRAWER OFFICE TIDY,626.74,66,27
SEASIDE FLYING DISC,626.53,507,83
MULTICOLOUR 3D BALLS GARLAND,626.19,233,71
MEDIUM PARLOUR PICTURE FRAME ,625.8000000000001,156,37
BLACK MINI TAPE MEASURE ,625.8,152,114
CINAMMON & ORANGE WREATH,625.63,-123,37
PINK UNION JACK  PASSPORT COVER ,625.23,234,107
EGG CUP NATURAL CHICKEN,622.74,933,125
VINTAGE CARAVAN GREETING CARD ,622.36,1360,142
SMALL MEDINA STAMPED METAL BOWL ,622.3,721,48
CHILDS GARDEN TROWEL BLUE ,622.0999999999999,622,117
BLACK CHAMPAGNE GLASS,621.39,1353,42
MIRROR MOSAIC GOBLET CANDLE HOLDER,619.82,334,34
KITCHEN FLOWER POTS WALL PLAQUE,619.59,116,83
MAGNETS PACK OF 4 RETRO PHOTO,619.43,1220,130
SWEETHEART CREAM STEEL TABLE RECT,618.66,27,21
GARDEN PATH JOURNAL,618.64,246,66
HANGING METAL RABBIT DECORATION,618.2,475,58
WOODLAND STORAGE BOX SMALL,616.18,252,49
MUM'S KITCHEN CLOCK,616.14,121,50
PHOTO FRAME LINEN AND LACE SMALL,615.6800000000001,296,62
SHOE SHINE BOX ,613.17,51,50
BATHROOM METAL SIGN ,613.14,408,74
LARGE APOTHECARY MEASURING JAR ,612.1600000000001,51,21
LIPSTICK PEN BABY PINK,611.72,1334,126
ABSTRACT CIRCLES SKETCHBOOK ,610.8100000000001,144,76
BLUE FELT EASTER EGG BASKET,610.45,345,72
METAL SIGN HIS DINNER IS SERVED,610.22,563,149
BLACK DINER WALL CLOCK,608.6899999999999,53,48
SET/6 EAU DE NIL BIRD T-LIGHTS,608.53,335,72
VINTAGE POST OFFICE CABINET,607.6500000000001,6,3
FOLDING UMBRELLA CHOCOLATE POLKADOT,607.23,133,59
SET/12 TAPER CANDLES,605.89,607,93
CHILDS GARDEN SPADE PINK,604.75,270,88
EMBROIDERED RIBBON REEL RUBY ,604.3,168,32
STORAGE TIN HOME SWEET HOME,604.01,268,59
FELT TOADSTOOL  SMALL,602.63,629,77
MOODY BOY  DOOR HANGER ,602.18,1087,125
12 DAISY PEGS IN WOOD BOX,600.87,309,78
SQUARE CHERRY BLOSSOM CABINET,600.55,89,24
GLASS JAR KINGS CHOICE,599.87,186,87
PINK POT PLANT CANDLE,599.29,194,37
SWISS CHALET TREE DECORATION ,598.82,1295,120
LARGE WHITE/PINK ROSE ART FLOWER,598.8000000000001,163,25
EASTER DECORATION HANGING BUNNY,596.5,1888,92
CERAMIC PLATE STRAWBERRY DESIGN,596.4,536,65
SET OF 4 NAPKIN CHARMS STARS   ,596.36,269,51
ORIGAMI JASMINE INCENSE/CANDLE SET,595.85,453,87
JARDIN ETCHED GLASS FRUITBOWL,595.19,111,44
SMALL STRIPES CHOCOLATE GIFT BAG ,594.51,867,28
SET OF PICTURE FRAME  STICKERS,593.37,135,62
BUNNY DECORATION MAGIC GARDEN,593.14,670,113
CHOCOLATE 1 WICK MORRIS BOX CANDLE,592.4,-943,53
PACK OF 12 DOLLY GIRL TISSUES,590.5,1346,134
ENVELOPE 50 BLOSSOM IMAGES,590.09,866,162
DARK BIRD HOUSE TREE DECORATION,588.97,1481,143
SET 12 VINTAGE DOILY CHALK ,587.49,1315,110
PINK HEARTS LIGHT CHAIN ,587.2,271,48
JARDIN ETCHED GLASS BUTTER DISH,586.6,184,42
FOLK FELT HANGING MULTICOL GARLAND,585.86,156,62
LETS GO SHOPPING COTTON TOTE BAG,585.34,252,78
PINK PAISLEY SQUARE TISSUE BOX ,584.48,1367,118
HAIRCLIPS FORTIES FABRIC ASSORTED,583.96,1340,62
BLUE ROSE FABRIC MIRROR,583.75,248,92
PINK CAT BOWL,583.3299999999999,360,123
PINK NEW BAROQUECANDLESTICK CANDLE,582.18,458,44
RED FLOCK LOVE HEART PHOTO FRAME,581.18,1200,84
I LOVE LONDON WALL ART,581.13,111,34
SET/6 FRUIT SALAD  PAPER PLATES,581.09,1259,105
YELLOW SHARK HELICOPTER,580.36,-5,54
EGG CUP MILKMAID HELGA ,580.06,405,65
ROSE FOLKART HEART DECORATIONS,579.68,445,90
PINK PADDED MOBILE,577.79,146,43
6PC WOOD PLATE SET DISPOSABLE,574.88,459,38
ANGEL DECORATION PAINTED ZINC ,574.54,912,77
JIGSAW RABBIT AND BIRDHOUSE,574.14,576,109
GIFT BAG BIRTHDAY,574.12,938,78
FELT EGG COSY BLUE RABBIT ,574.04,548,105
S/15 SILVER GLASS BAUBLES IN BAG,572.88,172,64
BUTTERFLY CROCHET FOOD COVER,572.23,148,66
DECORATIVE PLANT POT WITH FRIEZE,570.87,71,29
"SMALL POP BOX,FUNKY MONKEY",570.4499999999999,410,121
SMALL PARLOUR PICTURE FRAME,569.43,207,35
BEADED CRYSTAL HEART PINK LARGE,569.29,565,62
DINOSAUR HEIGHT CHART STICKER SET,568.98,182,46
EDWARDIAN PHOTO FRAME,568.71,90,32
ACRYLIC GEOMETRIC LAMP,568.65,15,21
LAUREL STAR ANTIQUE SILVER ,568.6,430,61
PACK OF 12 VINTAGE LEAF TISSUES ,567.9499999999999,1509,80
RED WHITE SCARF  HOT WATER BOTTLE,566.1700000000001,27,18
BLUE TEA TOWEL CLASSIC DESIGN,565.86,412,54
ROMANTIC IMAGES NOTEBOOK SET,564.35,414,33
SKULLS  DESIGN  COTTON TOTE BAG,563.67,240,80
BUTTERFLIES STICKERS,563.16,622,111
TREE T-LIGHT HOLDER WILLIE WINKIE,562.22,364,44
FELTCRAFT DOLL MARIA,561.97,85,52
PACK 6 HEART/ICE-CREAM PATCHES,561.87,398,99
SET/4 BADGES BALLOON GIRL,561.84,448,89
PINK ROSE WASHBAG,560.62,228,76
SET OF 6 VINTAGE NOTELETS KIT,560.11,522,44
WHITE GOOSE FEATHER TREE 60CM ,559.9499999999999,277,50
WHITE BAROQUE WALL CLOCK ,559.0,66,32
SILVER DIAMANTE PEN IN GIFT BOX,558.83,175,66
SQUARE MINI PORTRAIT FRAME,558.12,278,52
VINTAGE GLASS COFFEE CADDY,557.3000000000001,70,28
EAU DE NILE HEART SHAPE PHOTO FRAME,556.77,330,39
S/12 MINI RABBIT EASTER,556.53,337,69
GLASS TWIST BON BON JAR,555.3,71,25
LARGE PARLOUR PICTURE FRAME,554.83,113,31
SET OF 4 BLACK LOVEBIRD COASTERS,554.78,451,82
YULETIDE IMAGES GIFT WRAP SET,553.54,845,96
PINK AND WHITE CHRISTMAS TREE 120CM,553.0699999999999,201,34
WOODLAND SMALL RED FELT HEART,552.85,679,51
BLUE GLASS GEMS IN BAG,552.13,586,58
ASSORTED TUTTI FRUTTI NOTEBOOK,551.96,216,41
PINK  HONEYCOMB PAPER FAN,551.57,489,68
BLACK CHRISTMAS TREE 120CM,551.13,217,27
MIRROR MOSAIC T-LIGHT HOLDER ,551.04,902,32
ORIGAMI ROSE INCENSE/CANDLE SET ,550.64,463,97
CALENDAR FAMILY FAVOURITES,550.6,193,59
BLUE POLKADOT EGG CUP ,550.43,1018,66
JIGSAW TOADSTOOLS 3 PIECE,549.74,626,88
HYACINTH BULB T-LIGHT CANDLES,549.1,-755,49
WRAP BIRD GARDEN ,548.1,1305,52
RETRO LONGBOARD IRONING BOARD COVER,547.76,282,106
HEART TRELLISTRIPLE T-LIGHT HOLDER,547.35,185,35
GOLD FISHING GNOME,546.6,68,36
PINK GLASS CANDLEHOLDER,546.57,97,43
CUT GLASS T-LIGHT HOLDER OCTAGON,546.49,690,29
FELT EGG COSY WHITE RABBIT ,546.41,581,108
CARNIVAL BRACELET,545.28,43,27
DOORSTOP FOOTBALL DESIGN,543.65,153,67
PAPER LANTERN 9 POINT HOLLY STAR 40,543.51,81,23
EMBOSSED HEART TRINKET BOX,543.11,244,49
EMPIRE BIRTHDAY CARD,538.72,1206,147
HANGING HEART BONHEUR,537.9,609,70
HANGING BAUBLE T-LIGHT HOLDER SMALL,535.97,-19,29
CARD DOG AND BALL ,535.78,1229,131
SET OF 4 PISTACHIO LOVEBIRD COASTER,534.84,452,94
CHILDS GARDEN TROWEL PINK,533.16,520,107
FOLKART HEART NAPKIN RINGS,532.17,403,83
MINI JIGSAW BAKE A CAKE ,531.64,1455,55
CANDY SPOT HAND BAG,530.63,257,52
ORIGAMI SANDLEWOOD INCENSE/CAND SET,530.6,462,95
ENAMEL BLUE RIM BISCUIT BIN,530.49,63,45
ANTIQUE CREAM CUTLERY CUPBOARD,530.19,50,36
METAL TUBE CHIME ON BAMBOO,529.21,442,16
WRAP WEDDING DAY,528.5,1325,39
HEART BEADED TRELLIS DECORATION,528.1700000000001,249,42
WRAP MONSTER FUN ,527.94,1257,49
WEEKEND BAG VINTAGE ROSE PAISLEY,527.85,69,1
FRENCH STYLE EMBOSSED HEART CABINET,527.53,24,24
METAL SIGN CUPCAKE SINGLE HOOK,527.09,677,112
SET OF 2 ROUND TINS DUTCH CHEESE,526.26,250,80
ENAMEL PINK TEA CONTAINER,526.22,417,72
FUSCHIA RETRO BAR STOOL,523.3000000000001,12,6
EASTER TIN CHICKS IN GARDEN,522.9300000000001,305,50
EGG FRYING PAN PINK ,521.33,226,85
BEADED CRYSTAL HEART GREEN ON STICK,521.11,623,172
PINK HEART SHAPE PHOTO FRAME,520.91,235,42
BLUE TV TRAY TABLE ,518.61,95,40
PARTY INVITES DINOSAURS,518.03,599,95
BLUE PAISLEY SKETCHBOOK,517.22,123,63
FRENCH LATTICE CUSHION COVER ,517.05,440,64
SILVER GLASS T-LIGHT SET,516.9,-157,19
BLUE DRAGONFLY HELICOPTER,516.6,55,51
CHRISTMAS TREE DECORATION WITH BELL,515.14,1182,128
FOLDING UMBRELLA WHITE/RED POLKADOT,513.02,104,36
T-LIGHT HOLDER WHITE LACE,512.93,588,68
SINGLE WIRE HOOK PINK HEART,512.75,403,28
IVORY WIRE SWEETHEART LETTER TRAY,511.89,135,49
POCKET BAG PINK PAISELY BROWN SPOT,510.84000000000003,469,95
SILVER CHRISTMAS TREE BAUBLE STAND ,509.54999999999995,-22,27
RIDGED GLASS FINGER BOWL,509.35999999999996,983,60
CUPID DESIGN SCENTED CANDLES,509.07,225,43
DECORATION  PINK CHICK MAGIC GARDEN,508.94,574,111
PACK 20 ENGLISH ROSE PAPER NAPKINS,508.37,493,81
HENRIETTA HEN MUG ,508.26,290,46
PAINTED YELLOW WOODEN DAISY,505.74,599,118
ROSE DU SUD OVEN GLOVE,505.2,174,70
GLASS BONNE JAM JAR,504.97,121,27
PARTY CONES CARNIVAL ASSORTED,504.88,-346,24
ORANGE SCENTED SET/9 T-LIGHTS,502.54999999999995,481,90
SET OF 6 RIBBONS COUNTRY STYLE,502.07000000000005,173,26
FOLDING UMBRELLA PINKWHITE POLKADOT,501.98,107,45
GARDEN PATH SKETCHBOOK,501.07,124,57
PINK POLKADOT CHILDRENS UMBRELLA,500.46,-17,50
MIDNIGHT GLAMOUR SCARF KNITTING KIT,497.69,321,86
COOKING SET RETROSPOT,497.34999999999997,-1632,32
CHILDS GARDEN RAKE BLUE,496.99,208,63
UNION STRIPE CUSHION COVER ,496.25,397,69
SET OF 36 DINOSAUR PAPER DOILIES,496.17999999999995,333,67
BLUE NEW BAROQUE CANDLESTICK CANDLE,494.76,368,41
TOAST ITS - HAPPY BIRTHDAY,494.54,412,108
FRAPPUCINO SCARF KNITTING KIT,494.44,335,74
WOVEN FROST CUSHION COVER,492.79,117,59
RED/CREAM STRIPE CUSHION COVER ,492.4,400,62
PINK/WHITE CHRISTMAS TREE 60CM,492.36,683,43
RETROSPOT BABUSHKA DOORSTOP,491.45,250,55
TUSCAN VILLA DOVECOTE,489.78,54,28
VINTAGE PINK DECORATIVE PARASOL,489.74,55,26
PINK PAISLEY ROSE GIFT WRAP,488.0,1125,43
DOLLY HONEYCOMB GARLAND,487.11,475,25
PINK UNION JACK  LUGGAGE TAG,486.5,353,121
PAINTED PINK RABBIT ,486.01,573,136
BOYS ALPHABET IRON ON PATCHES,485.56,-1313,101
ORIGAMI LAVENDER INCENSE/CANDL SET ,484.34999999999997,399,86
LAUREL STAR ANTIQUE GOLD,483.03,379,40
ASSORTED MINI MADRAS NOTEBOOK,481.95,807,29
KEEP CALM BIRTHDAY WRAP,481.5,1175,38
COSY HOUR GIANT TUBE MATCHES,480.75,192,28
BEACH HUT SHELF W 3 DRAWERS,480.63,77,34
COSY SLIPPER SHOES LARGE GREEN,480.17,147,40
SET OF 4 NAPKIN CHARMS CROWNS ,479.33,299,53
SNOWSTORM PHOTO FRAME FRIDGE MAGNET,477.96,472,60
PANTRY HOOK BALLOON WHISK ,477.89,213,47
BABY BOOM RIBBONS ,477.34,248,89
VINTAGE RED TEATIME MUG,477.27,258,84
FAIRY SOAP SOAP HOLDER,477.14,265,77
LADYBIRD + BEE RAFFIA FOOD COVER,476.41,-17,40
SET OF 6 RIBBONS PARTY,476.0,170,16
CANDY SPOT EGG WARMER HARE,475.18,708,88
PINK ENAMEL+GLASS HAIR COMB,474.2,189,36
HANGING SPRING FLOWER EGG SMALL,470.78,1168,75
MIRRORED WALL ART PHOTO FRAMES,470.16999999999996,89,46
PARTY FOOD SHOPPER BAG,469.63,322,75
ASSTD FRUIT+FLOWERS FRIDGE MAGNETS,469.06999999999994,1738,71
JIGSAW TREE WITH WATERING CAN,467.39,1032,105
CRAZY DAISY HEART DECORATION,467.14,463,150
BLUE POLKADOT PASSPORT COVER,466.99,313,97
GOLD PHOTO FRAME,466.53,216,39
WHITE HAND TOWEL WITH BUTTERFLY,466.3,127,30
PACK OF 12 RED APPLE TISSUES,465.36,1220,76
MIRRORED WALL ART SKULLS,463.79,304,46
CHILDS GARDEN RAKE PINK,462.33,206,69
DANISH ROSE TRINKET TRAYS,460.83000000000004,257,32
BLACK CHRISTMAS TREE 60CM,460.64,558,25
ROSE DU SUD CUSHION COVER,460.58,78,46
PARTY PIZZA DISH PINK POLKADOT,460.38,1228,76
PARTY INVITES JAZZ HEARTS,458.31,528,102
PARTY INVITES SPACEMAN,458.22999999999996,539,74
FLYING PIG WATERING CAN,458.1,190,48
SET/4 BADGES DOGS,457.51,348,89
ASSORTED LAQUERED INCENSE HOLDERS,455.98,2497,26
LILAC DIAMANTE PEN IN GIFT BOX,454.99,141,63
CAKE STAND VICTORIAN FILIGREE LARGE,454.86,41,38
CLAM SHELL SMALL ,454.42,223,46
RIDGED BONNE JAM JAR T-LIGHT HOLDER,454.32,284,26
PINK FLOWER FABRIC PONY,453.73,87,50
HAND TOWEL PALE BLUE W FLOWERS,453.39,191,30
MINI PLAYING CARDS FUN FAIR ,452.72,1065,65
PARTY INVITES FOOTBALL,451.7,488,83
ASSORTED TUTTI FRUTTI KEYRING BALL,451.59,1104,50
WRAP MAGIC FOREST ,451.5,1075,43
DOORMAT FRIENDSHIP ,451.10999999999996,11,19
SET OF 3 GOLD FLYING DUCKS,450.74999999999994,125,22
SMALL PINK GLASS SUNDAE DISH,450.15999999999997,837,43
ABSTRACT CIRCLE JOURNAL ,449.8,185,72
SET OF 4 NAPKIN CHARMS 3 KEYS ,449.39,238,57
CERAMIC LOVE HEART MONEY BANK,448.78,721,47
RED HEART LUGGAGE TAG,447.34,279,97
MIRRORED WALL ART STARS,447.09,363,52
PAPERWEIGHT CHILDHOOD MEMORIES,445.44,268,36
SET OF 4 NAPKIN CHARMS LEAVES   ,445.17,240,48
RIDGED GLASS POSY VASE ,444.58,200,48
RABBIT  DESIGN  COTTON TOTE BAG,444.07,181,62
CHRISTMAS MUSICAL ZINC TREE,442.26,988,96
VINTAGE KEEPSAKE BOX TRAVELOGUE,441.89,49,57
GREEN FERN JOURNAL ,441.12,177,55
SILVER GLITTER FLOWER VOTIVE HOLDER,441.07,1304,58
IVORY STRING CURTAIN WITH POLE ,440.62,170,28
TROPICAL PASSPORT COVER ,439.65,262,99
EIGHT PIECE SNAKE  SET,439.54,333,84
NEW BAROQUE JEWELLERY BOX ,438.94,52,26
BEADED CRYSTAL HEART BLUE  LARGE,438.87,483,46
EAU DE NIL LOVE BIRD CANDLE,437.85999999999996,417,47
SMALL LICORICE DES PINK BOWL,437.2,427,87
"FLOWER FAIRY,5 SUMMER B'DRAW LINERS",436.05,171,46
PAPER LANTERN 9 POINT HOLLY STAR S,435.74,104,25
MINI JIGSAW BUNNIES,435.67,1142,76
RECTANGULAR SHAPED MIRROR,435.09000000000003,432,40
TABLE LAMP WHITE SHADE WOOD BASE,434.12,78,20
VINTAGE BEAD NOTEBOOK,433.19,183,54
BLACK BAROQUE CARRIAGE CLOCK,432.78999999999996,51,35
PAPERWEIGHT SAVE THE PLANET,431.55,238,46
CHRISTMAS HANGING SNOWFLAKE,430.86,490,48
BUNNY WOODEN PAINTED WITH FLOWER ,430.76,566,102
ROSE DU SUD DRAWSTRING BAG,428.65999999999997,125,66
UNION FLAG WINDSOCK,428.18999999999994,305,24
"CHARLIE+LOLA""EXTREMELY BUSY"" SIGN",428.0,683,105
VINTAGE SHELLS PRINT,427.46000000000004,41,33
MRS ROBOT SOFT TOY,426.9,142,29
WHITE STITCHED CUSHION COVER,426.13,59,22
SET/6 FRUIT SALAD PAPER CUPS,426.0,1666,104
BLUE SCOTTIE DOG W FLOWER PATTERN,424.08,177,50
IVORY PILLAR CANDLE GOLD FLOCK,424.08,94,32
3D SHEET OF DOG STICKERS,423.99,426,116
CHRYSANTHEMUM SKETCHBOOK ,423.55,104,59
GREEN SWEETHEART BRACELET,423.41,103,44
LAZER CUT NECKLACE W PASTEL BEADS,421.75,57,5
RED SHARK HELICOPTER,421.18,16,37
GREEN FERN SKETCHBOOK ,420.08,106,56
BLUE SCANDINAVIAN PAISLEY WRAP,420.0,700,40
