product_name,product_revenue,units_sold,order_count
LADLE LOVE HEART RED ,419.42,890,162
SET/12 FUNKY FELT FLOWER PEG IN BAG,419.01,202,49
SUMMER DAISIES BAG CHARM,417.96,167,88
MONEY BOX POCKET MONEY DESIGN,416.8,373,71
CANDLE PLATE LACE WHITE,416.6,193,56
JINGLE BELLS TREE DECORATION,415.77,175,80
PING! MICROWAVE PLATE,415.09,152,63
PAPER LANTERN 5 POINT STAR MOON 30,414.98,98,26
GLITTER CHRISTMAS TREE,414.63,824,60
SILVER ROCCOCO CHANDELIER,414.46999999999997,11,11
CAKES AND BOWS GIFT  TAPE,413.76,1166,93
ANT COPPER LIME BOUDICCA BRACELET,412.74,83,50
WHITE CANDYSTUFT ARTIFICIAL FLOWER,411.55999999999995,308,20
PIN CUSHION BABUSHKA BLUE,410.81,137,45
RETRO PLASTIC POLKA TRAY,409.74,838,84
HANGING WOOD AND FELT BUTTERFLY ,409.41,896,127
GLASS CHALICE BLUE SMALL ,408.37,617,55
SILVER PHOTO FRAME,407.73,135,38
DANISH ROSE DELUXE COASTER,407.15,935,41
GINGHAM BABUSHKA DOORSTOP,406.49,211,42
SILVER FISHING GNOME ,405.62,50,28
FOLKART CLIP ON STARS,405.25,786,100
EGG FRYING PAN BLUE ,405.0,175,76
HOUSE SHAPE PENCIL SHARPENER,404.84,3000,101
HOME SWEET HOME HOOK,403.93,323,48
MONEY BOX KINGS CHOICE DESIGN,402.21,345,85
SNACK TRAY RED VINTAGE DOILY,400.04,198,37
RED RETRO KITCHEN WALL CLOCK,400.01,47,23
CONDIMENT TRAY 4 BOWLS AND 4 SPOONS,399.02,28,28
RETROSPOT CANDLE  MEDIUM,398.28,341,44
GOLD STANDING GNOME,398.02,106,28
S/2 ZINC HEART DESIGN PLANTERS,398.0,40,28
ESSENTIAL BALM 3.5g TIN IN ENVELOPE,395.61,3050,31
ASSORTED COLOUR LIZARD SUCTION HOOK,395.1,999,55
FELT FARM ANIMAL CHICKEN,394.15,291,50
PINK ROSE FABRIC MIRROR,393.46999999999997,60,63
LOLITA  DESIGN  COTTON TOTE BAG,391.72,168,53
EGG FRYING PAN MINT ,388.75,180,69
BLACK SWEETHEART BRACELET,388.58,92,48
BLUE VICTORIAN FABRIC OVAL BOX,388.57,925,100
IVORY SWEETHEART SOAP DISH,388.26,147,50
T-LIGHT HOLDER SILVER HEART HANDLE,388.01,193,29
HEARTS GIFT TAPE,386.77,1178,94
PARTY PIZZA DISH BLUE POLKADOT,384.32,1102,72
GREEN BITTY LIGHT CHAIN,383.25,194,60
CUTE CATS TAPE,383.11,1102,79
BIRTHDAY BANQUET GIFT WRAP,383.0,950,33
BLUE CUSHION COVER WITH FLOWER,381.78000000000003,41,30
PARTY PIZZA DISH GREEN POLKADOT,381.65999999999997,1037,59
HAWAIIAN GRASS SKIRT ,380.36,324,28
MIRRORED WALL ART SNOWFLAKES,380.04,500,48
POPART WOODEN PENCILS ASST,380.0,4333,70
WOVEN SUNSET CUSHION COVER ,378.29,89,37
ANT COPPER TURQ BOUDICCA BRACELET,377.88,76,37
RIBBONS PURSE ,377.2,405,54
TURQ+RED BOUDICCA LARGE BRACELET,377.04,54,26
PAIR PADDED HANGERS PINK CHECK,376.27,112,43
ORIGAMI VANILLA INCENSE/CANDLE SET ,375.93,237,66
DOLLY CABINET 2 DRAWERS ,375.0,30,21
MADRAS NOTEBOOK LARGE ,374.96000000000004,264,18
SET/3 POLKADOT STACKING TINS,374.7,61,31
CAMOUFLAGE EAR MUFF HEADPHONES,373.57,54,27
STRAWBERRIES  DESIGN FLANNEL ,373.34,358,105
ANIMAL STICKERS,372.33,1773,46
HAND TOWEL PINK FLOWER AND DAISY,372.33,217,23
EAU DE NILE JEWELLED PHOTOFRAME,371.25,225,24
PLASMATRONIC LAMP,369.95,65,28
SILVER VANILLA  FLOWER CANDLE POT,369.87,-228,27
PINK & WHITE BREAKFAST TRAY,369.84000000000003,82,37
SNACK TRAY PAISLEY PARK,367.35,179,32
MAGIC DRAWING SLATE LEAP FROG ,366.75,1072,73
EASTER DECORATION NATURAL CHICK,366.15,540,64
ROSE DU SUD COSMETICS BAG,365.09,56,53
GRASS HOPPER WOODEN WALL CLOCK ,365.01,289,40
BLUE PATCH PURSE PINK HEART,363.22,148,44
SNACK TRAY I LOVE LONDON,362.65,179,38
RETROSPOT CANDLE  LARGE,362.12,273,30
PINK SPOTS CHOCOLATE NESTING BOXES ,361.56000000000006,148,7
SMALL FOLDING SCISSOR(POINTED EDGE),360.71,1382,71
MILK MAIDS MUG ,360.59,199,37
SMALL FOLKART STAR CHRISTMAS DEC,359.59999999999997,573,58
PARTY INVITES BALLOON GIRL,359.28999999999996,405,71
BLUE & WHITE BREAKFAST TRAY,358.1,87,39
GREEN ENAMEL+GLASS HAIR COMB,357.74,186,55
SKULLS SQUARE TISSUE BOX,356.46,757,59
BLACK LOVE BIRD CANDLE,356.06,329,62
PACK 3 IRON ON DOG PATCHES,355.84,276,66
PANDA AND BUNNIES STICKER SHEET,355.83,408,81
PINK LOVE BIRD CANDLE,354.83,350,51
ROSE DU SUD WASHBAG ,354.14,74,50
CUBIC MUG PINK POLKADOT,354.03,413,48
RIDGED GLASS STORAGE JAR CREAM LID,353.97,119,19
ALPHABET HEARTS STICKER SHEET,353.47999999999996,401,59
PANTRY HOOK TEA STRAINER ,353.45,165,32
PANTRY HOOK SPATULA,353.36,162,33
SET/4 BADGES BEETLES,353.19,269,73
GREEN GOOSE FEATHER TREE 60CM,353.07,169,43
RED VICTORIAN FABRIC OVAL BOX,352.25,862,98
"TUMBLER, BAROQUE",352.18,-65,50
BLUE POLKADOT LUGGAGE TAG ,350.61,235,81
CERAMIC STRAWBERRY TRINKET TRAY,350.47,369,70
MAGIC DRAWING SLATE GO TO THE FAIR ,349.87,853,70
GLASS CHALICE GREEN  LARGE ,349.52,104,22
SET/3 POT PLANT CANDLES,349.16,39,37
SCOTTIES CHILDRENS APRON,348.92,5,60
WAKE UP COCKEREL CALENDAR SIGN ,348.59000000000003,81,33
PORCELAIN ROSE LARGE ,348.43,430,17
MULTICOLOUR  CONFETTI IN TUBE,348.31,263,28
RETROSPOT CANDLE  SMALL,345.82,368,44
GREEN CAT FLORAL CUSHION COVER ,345.17,-48,55
BEADED CRYSTAL HEART PINK SMALL,343.99,208,65
MIRROR MOSAIC CANDLE PLATE,343.71,288,59
SMALLFOLKART BAUBLE CHRISTMAS DEC,343.57,-312,44
SILVER FLOWR PINK SHELL NECKLACE,342.76,53,4
ASSTD DESIGN 3D PAPER STICKERS,340.93,13645,33
DENIM PATCH PURSE PINK BUTTERFLY,340.79,66,63
SET/4 BADGES CUTE CREATURES,340.22,261,54
BLUE  DIAMANTE PEN IN GIFT BOX,340.08,94,55
PHOTO CLIP LINE,338.73,239,49
MINI JIGSAW DINOSAUR ,337.39,807,102
COFFEE SCENT PILLAR CANDLE,336.74,325,61
FLOWERS TILE COASTER,334.76,992,39
PAPER LANTERN 5 POINT SEQUIN STAR,333.5,58,25
CINNAMON SCENTED VOTIVE CANDLE,333.2,1288,39
MINI  ZINC GARDEN DECORATIONS ,333.17999999999995,930,37
FELT FARM ANIMAL HEN,332.84,481,44
SMALL KITCHEN FLOWER POTS PLAQUE,331.5,32,38
PURPLE SWEETHEART BRACELET,328.44,78,50
WHITE SAGE INCENSE,326.64,1382,68
PINK JEWELLED PHOTO FRAME ,326.35,57,20
HANGING WOOD AND FELT FLOWER,325.84,923,106
CANDLE HOLDER SILVER MADELINE,325.16,196,20
PACK/12 XMAS FUN CARD,325.09000000000003,167,53
FRUIT TREE AND BIRDS WALL PLAQUE,324.68,6,29
WOODLAND LARGE PINK FELT HEART,324.40000000000003,285,13
DOILY THANK YOU CARD,323.32,765,57
PINK FELT EASTER RABBIT GARLAND,323.15000000000003,122,29
LADLE LOVE HEART PINK,322.8,568,179
PINK SCOTTIE DOG W FLOWER PATTERN,322.54,135,51
BLUE PAISLEY TISSUE BOX,322.18,672,91
BLUE EGG  SPOON,322.18,1857,106
PARTY TIME PENCIL ERASERS,322.09,1398,134
BLACK LOVE BIRD T-LIGHT HOLDER,320.89,183,30
SKULLS STORAGE BOX LARGE,320.49,87,30
KITTY PENCIL ERASERS,320.09,1438,136
MIRRORED WALL ART POPPIES,319.71,287,38
SPACE OWL,319.5,258,68
ANT COPPER PINK BOUDICCA BRACELET,318.89,64,34
GREEN HEART COMPACT MIRROR,318.31,227,35
BLACK EAR MUFF HEADPHONES,318.19,48,28
PIECE OF CAMO STATIONERY SET,317.92,105,33
HELLO SAILOR BLUE SOAP HOLDER,317.3,164,54
FUNKY MONKEY CUSHION COVER,317.17,232,46
NEWSPAPER STAND,316.95,26,6
FORKED CACTUS CANDLE,316.71,99,35
PEACH KNITTED HEN ,316.46,302,62
VINTAGE ROSE BEAD BRACELET RASPBERR,315.73,75,44
MILK PAN PINK POLKADOT,315.6,-49,42
LARGE CAMPHOR WOOD FIELD MUSHROOM ,315.27,43,27
HANGING WOOD AND FELT HEART,314.81,676,106
SET/6 BLACK BIRD T-LIGHT CANDLES,314.65,214,40
PINK GINGHAM CAT WITH SCARF,314.51,91,32
FAIRY DREAMS INCENSE ,313.31,1264,101
FLOOR LAMP SHADE WOOD BASE,312.7,33,13
SET OF 4 POLKADOT COASTERS,312.53,174,77
GREEN BIRDHOUSE DECORATION,310.49,440,59
KITTENS DESIGN FLANNEL,310.19,337,100
SET/6 BEAD COASTERS GAUZE BAG GOLD,309.29999999999995,818,29
SET OF 2 TEA TOWELS PING MICROWAVE,309.11,150,76
LOVELY BONBON STICKER SHEET,307.44,345,58
SCOTTIES DESIGN WASHBAG,306.75,166,59
SET OF 3 PANTRY WOODEN SPOONS,306.66,225,41
VIPPASSPORT COVER ,305.8,186,51
BLACK SQUARE TABLE CLOCK,305.2,116,30
CHRISTMAS CARD SCREEN PRINT ,304.5,1189,66
BOTANICAL ROSE GIFT WRAP,304.5,725,28
CHUNKY SILVER NECKLACE PASTEL FLOWE,304.11,30,24
SET OF 4 NAPKIN CHARMS INSTRUMENT,303.73,139,37
SET OF 6 HALLOWEEN GHOST T-LIGHTS,303.55,657,84
SILVER ROCOCO CANDLE STICK,303.45,94,18
SKULLS DESIGN FLANNEL,302.81,275,104
BLUE RETRO KITCHEN WALL CLOCK,301.88,36,18
COLUMBIAN CANDLE RECTANGLE,301.86,182,29
WHITE/PINK CHICK DECORATION,301.26,252,20
DECORATIVE HANGING SHELVING UNIT,299.75,5,6
WOOD AND GLASS MEDICINE CABINET,299.5,8,11
PAINT YOUR OWN EGGS IN CRATE,299.36,164,5
MONEY BOX BISCUITS DESIGN,298.47,207,59
AMETHYST CHUNKY BEAD BRACELET W STR,297.94,33,21
4 SKY BLUE DINNER CANDLES,297.91,150,62
MIXED NUTS LIGHT GREEN BOWL,296.45,635,70
EASTER BUNNY GARLAND OF FLOWERS,293.8,615,79
SMOKEY GREY COLOUR D.O.F. GLASS,293.31,825,42
WOVEN CANDY CUSHION COVER ,292.56,68,39
QUEEN OF SKIES LUGGAGE TAG,292.29,197,99
MULTICOLOUR RABBIT EGG WARMER,292.07,339,71
BLUE BIRDHOUSE DECORATION,292.03,421,62
 4 PURPLE FLOCK DINNER CANDLES,290.8,144,38
EGG CUP HENRIETTA HEN PINK,290.33,210,38
IVORY HANGING DECORATION  EGG,290.2,733,51
MEDIUM CHINESE STYLE SCISSOR,289.98,373,27
CORDIAL GLASS JUG,288.88,34,21
TOYBOX  WRAP ,288.5,501,26
"PINK/WHITE ""KEEP CLEAN"" BULLET BIN",286.90999999999997,77,33
QUEEN OF THE SKIES PASSPORT COVER ,286.39,148,76
WRAP CHRISTMAS SCREEN PRINT,285.75,950,35
COLUMBIAN CANDLE ROUND,285.39,412,51
WHITE AND BLUE CERAMIC OIL BURNER,283.93,125,43
RIDGED GLASS T-LIGHT HOLDER,283.51,412,43
CARTOON  PENCIL SHARPENERS,283.31,3821,64
CHRYSANTHEMUM NOTEBOOK,282.49,169,80
SMALL PINK MAGIC CHRISTMAS TREE,282.38,464,42
CURIO CABINET LINEN AND LACE ,281.95,35,19
PEARLISED IVORY HEART SMALL ,281.17,228,29
FELT FARM ANIMAL SHEEP,280.42,373,42
STANDING FAIRY POLE SUPPORT ,280.2,348,22
DANISH ROSE BEDSIDE CABINET,279.65000000000003,-14,16
SWEETIES  STICKERS,277.24,301,50
WRAP DAISY CARPET ,277.2,660,25
MIRRORED DOVE WALL DECORATION,276.71999999999997,116,24
4 ROSE PINK DINNER CANDLES,276.59,174,45
LA PALMIERA TILE COASTER,276.53,709,34
ZINC WIRE SWEETHEART LETTER TRAY,275.62,83,23
GREEN METAL SWINGING BUNNY,275.62,316,43
SET OF SKULL WALL STICKERS,274.37,95,20
STRAWBERRY DREAM CHILDS UMBRELLA,273.81,36,38
DOORSTOP RACING CAR DESIGN,273.46,124,38
SILVER DISCO HANDBAG,272.99,129,35
TRIPLE WIRE HOOK PINK HEART,272.91,79,25
NUMBER TILE VINTAGE FONT No ,272.2,173,33
BLUE PAISLEY POCKET BOOK,272.02,307,62
STAR  T-LIGHT HOLDER ,271.68,-141,30
SILVER MINI TAPE MEASURE ,271.22,149,29
TUB 24 PINK FLOWER PEGS,271.04,234,60
WOODLAND SMALL BLUE FELT HEART,270.96000000000004,312,37
CHRYSANTHEMUM  JOURNAL,269.68,103,40
RAIN PONCHO ,269.61,265,7
MOROCCAN BEATEN METAL MIRROR,268.1,-6,14
ORIGAMI ROSE INCENSE IN TUBE,267.82,506,15
STRAWBRY SCENTED VOTIVE CANDLE,267.45,875,26
PINK GOOSE FEATHER TREE 60CM,267.21,131,19
HAND OPEN SHAPE DECO.WHITE,266.53000000000003,55,7
MOUSEY LONG LEGS SOFT TOY,266.03,81,42
4 PINK DINNER CANDLE SILVER FLOCK,264.82,132,35
WOODLAND LARGE RED FELT HEART,264.72,205,22
PINK BOUDICCA LARGE BRACELET,264.7,38,12
CLEAR LOVE BIRD T-LIGHT HOLDER,264.46999999999997,92,26
S/4 BLACK MINI ROSE CANDLE IN BOWL,264.12,304,68
VINTAGE NOTEBOOK PARIS DAYS,262.87,95,26
12 PINK ROSE PEG PLACE SETTINGS,262.5,213,25
GREEN JUICY FRUIT PHOTO FRAME,261.89,86,40
PINK RIVIERA HANDBAG,261.68,222,8
FOOD/DRINK SPONGE STICKERS,261.24,1244,35
ASSORTED MONKEY SUCTION CUP HOOK,260.88,652,46
BUNNY EGG GARLAND,260.77,508,79
BLUE  TILE HOOK,259.84,90,29
HANGING MEDINA LANTERN SMALL,259.67,70,31
VINTAGE KITCHEN PRINT FRUITS,258.5,96,31
MAGAZINE RACK GEBRA ASSORTED ,257.75,199,18
BLUE FLOCK GLASS CANDLEHOLDER,257.67999999999995,631,13
ROSE DU SUD CUSHION COVER ,257.61,59,34
BLUE KNITTED HEN ,257.22,220,50
2 PICTURE BOOK EGGS EASTER BUNNY,256.54,182,36
ANTIQUE CREAM CUTLERY SHELF ,254.98000000000002,42,20
CAMPHOR WOOD PORTOBELLO MUSHROOM,254.32999999999998,184,50
CERAMIC BIRDHOUSE CRESTED TIT SMALL,253.53,67,23
SKULLS TAPE,252.47,706,70
FOLK ART METAL STAR T-LIGHT HOLDER,252.32999999999998,485,67
3D SHEET OF CAT STICKERS,252.22,98,77
VINTAGE CARAVAN GIFT WRAP,252.0,500,31
STRING OF STARS CARD HOLDER,250.22,-2,16
SKULLS STORAGE BOX SMALL,250.14,93,44
CHARLIE+LOLA MY ROOM DOOR SIGN,249.49,403,84
BLUE JUICY FRUIT PHOTO FRAME,248.76,87,40
ECONOMY LUGGAGE TAG,248.09,159,62
TUSCAN VILLA FEEDING STATION,247.63,29,16
MONEY BOX HOUSEKEEPING DESIGN,247.42000000000002,237,58
HEN PARTY CORDON BARRIER TAPE,246.38,201,41
ASSORTED TUTTI FRUTTI LARGE PURSE,245.7,117,26
WHITE GLASS CHUNKY CHARM BRACELET,245.63,27,25
PAPERWEIGHT HOME SWEET HOME,245.58,158,29
FLOWERS  STICKERS,245.35999999999999,257,61
SILVER TEDDY BEAR,244.72,64,27
NUMBER TILE COTTAGE GARDEN 1,244.19,95,45
CHERRY BLOSSOM PASSPORT COVER,243.53,194,71
THREE CANVAS LUGGAGE TAGS,243.49,150,48
ORANGE VOTIVE CANDLE,243.12,984,26
CANDY SPOT EGG WARMER RABBIT,242.32,641,90
NUMBER TILE COTTAGE GARDEN 2,242.24,94,39
WOODLAND SMALL PINK FELT HEART,242.18,286,31
CLASSICAL ROSE SMALL VASE,241.99,106,16
CROCHET ROSE PURSE WITH SUEDE BACK,241.24,76,22
ZINC WIRE KITCHEN ORGANISER,239.97,30,16
NINJA RABBIT BLACK,239.24,187,58
BATHROOM SET LOVE HEART DESIGN,237.98,82,14
ASSORTED TUTTI FRUTTI HEART BOX,237.5,361,36
SILVER BRACELET W PASTEL FLOWER,237.18,31,20
SNACK TRAY HAPPY FOREST  ,236.87,117,25
JOY LARGE WOOD LETTERS,236.17,35,17
DAISY NOTEBOOK ,235.19,71,65
LETTER SHAPE PENCIL SHARPENER,234.0,3333,45
T-LIGHT HOLDER SILVER PETIT FOUR ,233.67000000000002,185,16
SPACE FROG,233.52,174,56
BLACK ENAMEL FLOWER RING,232.25,79,25
PINK BUNNY EASTER EGG BASKET,231.9,158,4
PINK JEWELLED PHOTO FRAME,231.56,30,20
KEEP OUT BOYS DOOR HANGER ,231.36999999999998,-24,46
FLORAL SOFT CAR TOY,230.81,54,30
PINK MONTE CARLO HANDBAG,230.38,97,13
BLUE BUNNY EASTER EGG BASKET,230.25,157,3
CRYSTAL DIAMANTE STAR BROOCH,229.68,46,31
4 BLUE DINNER CANDLES SILVER FLOCK,229.22,73,33
SET OF 36 MUSHROOM PAPER DOILIES,229.1,298,32
BUNNY EGG BOX,228.75,189,27
AMBER GLASS/SILVER BRACELET,227.89,25,16
RED RETROSPOT WASHBAG,227.6,79,34
TRAVEL CARD WALLET VINTAGE ROSE ,226.2,-8516,54
GREEN ENAMEL FLOWER RING,225.84,77,31
ASSORTED SHAPES PHOTO CLIP SILVER ,225.60999999999999,449,13
PINK/BLUE DISC/MIRROR STRING,225.44999999999996,488,17
ST TROPEZ NECKLACE,224.12,45,35
ANTIQUE IVORY WIRE BOWL SMALL,224.06,88,23
MILK BOTTLE WITH GLASS STOPPER ,223.46,30,17
BOX/12 CHICK & EGG IN BASKET,223.11,121,42
SET/4 BLUE FLOWER CANDLES IN BOWL,222.87,132,39
SILVER OVAL SHAPE TRINKET BOX,221.8,25,17
BLUE HEART COMPACT MIRROR,221.25,127,17
2 PICTURE BOOK EGGS EASTER CHICKS,220.97,170,26
BOTANICAL LAVENDER BIRTHDAY CARD,220.55,492,81
PAPERWEIGHT VINTAGE PAISLEY,220.04,152,33
CURIOUS  IMAGES NOTEBOOK SET,219.72,62,13
PINK CHICK EGG WARMER + EGG CUP,219.66,210,43
SILVER FABRIC MIRROR,219.35,458,46
CRYSTAL STUD EARRINGS ASSORTED COL ,218.88,576,16
ASSTD COL BUTTERFLY/CRYSTAL W/CHIME,218.87,459,13
SMALL TALL CAMPHOR WOOD TOADSTOOL,217.89000000000001,142,34
SILVER/MOP ORBIT NECKLACE,217.59,15,22
ZINC HEART LATTICE CHARGER LARGE,217.57999999999998,52,18
DAISY JOURNAL ,217.56,80,34
SILVER STANDING GNOME   ,217.35999999999999,44,22
PURPLE BOUDICCA LARGE BRACELET,216.29000000000002,31,16
PEACE SMALL WOOD LETTERS,216.21,29,25
GOLD EAR MUFF HEADPHONES,216.16,37,26
ASS COLOUR GLOWING TIARAS,216.06,282,25
SMALL CAMPHOR WOOD FIELD  MUSHROOM,215.68,121,41
PAPERWEIGHT KINGS CHOICE ,215.38,162,24
GREEN MURANO TWIST BRACELET,215.20000000000002,51,22
SMALL CHUNKY GLASS ROMAN  BOWL,214.73000000000002,154,17
BOOZE & WOMEN GREETING CARD ,213.35,502,59
NUMBER TILE VINTAGE FONT 3,211.75,107,43
BLUE SWEETHEART BRACELET,211.43,21,28
COLUMBIAN CANDLE ROUND ,210.60999999999999,140,32
GREEN ROUND COMPACT MIRROR,210.56,117,22
PINK JEWELLED MIRROR TRINKET TRAY,210.54999999999998,34,18
WAKE UP COCKEREL TILE COASTER,210.52,604,35
TIGRIS EYE CHUNKY CHARM BRACELET,210.04,23,20
RED BOUDICCA LARGE BRACELET,209.73,30,12
LARGE SKULL WINDMILL,209.60999999999999,91,24
HANGING GLASS ETCHED TEALIGHT,208.47,197,13
METALIC LEAVES BAG CHARMS,207.60999999999999,84,36
TEATIME ROUND PENCIL SHARPENER ,205.42,1461,67
DAISY SKETCHBOOK ,205.04,73,27
MULTI HEARTS  STICKERS,204.69,237,42
GREEN SQUARE COMPACT MIRROR,203.51,131,20
OPIUM SCENTED VOTIVE CANDLE,203.28,840,18
ENGLISH ROSE SMALL SCENTED FLOWER,202.53,219,45
MINI JIGSAW LEAP FROG,202.37,504,35
NUMBER TILE COTTAGE GARDEN No,202.09,74,34
PINK BITTY LIGHT CHAIN,201.31,106,36
NUMBER TILE VINTAGE FONT 1,200.59,99,32
ASS COL CIRCLE MOBILE ,200.46,539,13
SET OF 16 VINTAGE BLACK CUTLERY,200.21,8,6
BLACK CHUNKY BEAD BRACELET W STRAP,199.67,22,18
BOTANICAL LAVENDER GIFT WRAP ,199.5,475,19
"WRAP, CAROUSEL",199.5,475,18
MIRRORED WALL ART GENTS,199.48999999999998,171,43
JADE DROP EARRINGS W FILIGREE,199.20000000000002,40,26
HANGING METAL CHICKEN DECORATION,198.52,152,34
LARGE  TALL CAMPHOR WOOD TOADSTOOL ,197.81,37,17
NUMBER TILE VINTAGE FONT 2,197.56,102,34
SILVER M.O.P ORBIT BRACELET,197.09,38,27
CHRISTMAS CARD STACK OF PRESENTS,196.44,576,37
SILVER BOOK MARK WITH BEADS,196.35999999999999,133,39
FIRST CLASS PASSPORT COVER ,194.94,93,43
A PRETTY THANK YOU CARD,194.58,456,35
NUMBER TILE VINTAGE FONT 5,194.04999999999998,99,36
FIRST CLASS LUGGAGE TAG ,193.59,152,49
?,193.32999999999998,-24,17
DIAMANTE BOW BROOCH GREEN COLOUR,193.2,30,18
PINK PAISLEY CUSHION COVER ,192.14,10,18
RAINBOW PEGS PHOTO CLIP STRING,191.18,292,39
RED KUKUI COCONUT SEED NECKLACE,190.73000000000002,122,25
PURPLE ENAMEL FLOWER RING,190.71,65,29
NINJA RABBIT PINK,190.29,153,45
STARFISH SOAP DISH,189.75,74,25
ROUND WHITE CONFETTI IN TUBE,189.68,108,13
NUMBER TILE VINTAGE FONT 4,189.53,99,33
WHITE CHRISTMAS STAR DECORATION,189.42,374,32
SILVER M.O.P ORBIT DROP EARRINGS,189.08,45,38
ROUND PINK HEART MIRROR,188.81,85,22
BLUE DELPHINIUM ARTIFICIAL FLOWER,188.37,3,7
PSYCHEDELIC TILE COASTER,188.26,406,29
FLORAL PINK MONSTER,187.54,-67,17
PINK OVAL SHAPE TRINKET BOX,186.64,20,13
75 GREEN PETIT FOUR CASES,186.25,375,74
SET/4 DAISY MIRROR MAGNETS,185.71,476,46
RED  EGG  SPOON,185.51999999999998,1222,93
MEDIUM PINK BUDDHA HEAD ,185.45,55,21
CHAMBRE HOOK,184.68,132,25
GOLD/M.O.P PENDANT ORBIT NECKLACE,184.66,22,19
FRENCH ENAMEL UTENSIL HOLDER,183.71,45,16
SET OF 4 CAROUSEL PLACEMATS ,183.45,91,23
GARDEN METAL SIGN ,183.41,77,33
CAROUSEL DESIGN WASHBAG,182.29,99,55
BOTANICAL LILY GREETING CARD,181.98,427,60
RETRO PLASTIC 70'S TRAY,181.85,375,66
EIGHT PIECE DINOSAUR SET,181.43,124,37
SET/4 BIRD MIRROR MAGNETS ,181.04,437,55
PSYCHEDELIC TILE HOOK,181.0,294,45
PINK YELLOW PATCH CUSHION COVER,180.93,26,24
ASSORTED CHEESE FRIDGE MAGNETS,180.71,314,20
CREAM DELPHINIUM ARTIFICIAL FLOWER,180.58,-55,9
PINK DISCO HANDBAG,180.51999999999998,-69,23
ANGEL DECORATION WITH LACE PADDED,180.2,243,12
CANDY SHOP  STICKER SHEET,179.45999999999998,195,33
GREEN  DIAMANTE PEN IN GIFT BOX,178.89,76,33
BEADED CRYSTAL HEART BLUE ON STICK,178.85,193,50
SWIRLY CIRCULAR RUBBERS IN BAG,178.54999999999998,471,60
NUMBER TILE COTTAGE GARDEN 4,177.46,72,30
Dotcomgiftshop Gift Voucher £30.00,175.53,37,8
BLACK GLASS BRACELET W HEART CHARMS,174.73000000000002,35,27
PACK 20 DOLLY PEGS,174.5,244,5
GLASS CHALICE GREEN  SMALL ,174.13,163,21
BEACH HUT KEY CABINET,173.58,47,23
S/4 GROOVY CAT MAGNETS,173.58,146,28
PINK BUTTERFLY CUSHION COVER ,173.48,30,22
FUNKY MONKEY GIFT BAG MEDIUM,173.12,415,42
WHITE SQUARE TABLE CLOCK,172.75,105,21
PINK HEARTS PAPER GARLAND,172.70000000000002,86,10
50CM METAL STRING WITH  7 CLIPS,172.64,226,23
SPACE CADET RED,172.2,141,33
BATHROOM SCALES FOOTPRINTS IN SAND,172.05,51,20
PINK PAINTED KASHMIRI CHAIR,171.8,4,1
PINK RETRO BIG FLOWER BAG,171.6,88,14
DIAMANTE BOW BROOCH RED COLOUR,171.45,30,11
GREEN CHRISTMAS TREE STRING 20LIGHT,171.3,60,14
JARDIN ETCHED GLASS SMALL BELL JAR,171.11,53,10
NUMBER TILE VINTAGE FONT 6 ,170.82999999999998,95,29
MEDIUM WHITE/PINK ROSE ART FLOWER,169.24,0,13
BEADED CRYSTAL HEART GREEN SMALL,168.59,119,31
CHRISTMAS CARD SINGING ANGEL,168.33,202,41
CLASSIC WHITE FRAME,168.16,56,16
SILVER HOOP EARRINGS WITH FLOWER,168.0,28,18
RED ENAMEL FLOWER RING,167.72,57,22
JARDIN ETCHED GLASS LARGE BELL JAR,167.7,47,14
Dotcomgiftshop Gift Voucher £50.00,167.56,4,4
FLAG OF ST GEORGE CHAIR,167.45,35,10
MIDNIGHT BLUE GLASS/SILVER BRACELET,167.3,43,16
Dotcomgiftshop Gift Voucher £20.00,167.05,20,10
2 PICTURE BOOK EGGS EASTER DUCKS,165.89,124,25
VINTAGE KITCHEN PRINT VEGETABLES,165.75,65,12
MOROCCAN BEATEN METAL DISH LARGE,165.74,12,8
LAVENDER SCENT CAKE CANDLE,165.6,398,19
MIDNIGHT BLUE VINTAGE EARRINGS,165.32,44,33
PAISLEY PARK CARD,165.08,376,41
MINI JIGSAW GO TO THE FAIR,164.84,403,40
FELT EGG COSY LADYBIRD ,164.48,278,52
MOCK LOBSTER FRIDGE MAGNET,164.17,296,45
BLUE MURANO TWIST BRACELET,164.12,39,15
SILVER LARIAT 40CM,163.82,-34,11
MONEY BOX CONFECTIONERY DESIGN,163.69,146,29
NUMBER TILE COTTAGE GARDEN 3 ,163.35,67,25
ENAMEL BLUE RIM COFFEE CONTAINER,163.3,147,30
PINK STRAWBERRY HANDBAG ,163.1,63,36
CHARLIE AND LOLA CHARLOTTE BAG,162.20999999999998,59,28
CLASSICAL ROSE CANDLESTAND,162.2,186,14
MIRRORED WALL ART SPLODGES,161.49,101,16
SET 4 PICNIC CUTLERY BLUEBERRY,159.9,82,9
GOLD M PEARL  ORBIT NECKLACE,158.73999999999998,16,16
"DECOUPAGE,GREETING CARD,",158.63,357,32
GREEN VINTAGE EARRINGS ,158.08,39,28
PORCELAIN BUDAH INCENSE HOLDER,158.06,1525,34
BLUE CIRCLES DESIGN MONKEY DOLL,157.88,63,31
BATHROOM HOOK,157.5,146,27
BLUE CIRCLES DESIGN TEDDY,157.5,36,26
OLD ROSE COMBO BEAD NECKLACE,157.5,54,45
GREEN WIRE STANDING CANDLE HOLDER,157.34,38,18
VINTAGE BEAD COSMETIC BAG ,156.85,14,36
TUSCAN VILLA BIRD TABLE ,156.75,19,11
BLUE FLY SWAT,156.63,179,66
LUNCH BOX WITH CUTLERY FAIRY CAKES ,155.54999999999998,94,27
ASSORTED CIRCULAR MOBILE,155.4,696,34
PANTRY KITCHEN THERMOMETER ,154.52,112,31
RETRO PLASTIC DAISY TRAY,154.39,288,61
ASS DES PHONE SPONGE CRAFT STICKER,154.39,511,14
ANTIQUE GLASS PLACE SETTING,152.5,165,10
VINTAGE ROSE BEAD BRACELET BLACK,152.4,36,17
BLUE ROUND COMPACT MIRROR,152.18,-106,21
NEW BAROQUE BLACK PHOTO ALBUM,152.11,22,15
LARGE TORTILLA DESIGN RED BOWL,151.39000000000001,87,24
PURPLE ENAMEL+GLASS HAIR COMB,151.2,78,5
BLUE PUDDING SPOON,151.19,1052,82
WHITE TISSUE REAM,151.05,-12,14
YELLOW DRAGONFLY HELICOPTER,151.05,28,11
NUMBER TILE COTTAGE GARDEN 6,150.81,65,21
FRENCH CHATEAU LARGE PLATTER ,150.75,73,20
BOYS PARTY BAG,150.54999999999998,47,11
COSY SLIPPER SHOES SMALL  RED ,150.48,45,23
BLUE PAINTED KASHMIRI CHAIR,149.85,3,1
"RUSTIC WOODEN CABINET, GLASS DOORS",149.82,7,5
BLACK VINTAGE EARRINGS,149.41000000000003,36,31
POLYESTER FILLER PAD 45x30cm,149.35,103,38
BLOND DOLL DOORSTOP,149.25,115,14
NUMBER TILE COTTAGE GARDEN 7,149.09,63,25
CRYSTAL DIAMANTE EXPANDABLE RING,148.63,35,11
BLUE CAT BISCUIT BARREL PINK HEART,148.32,53,19
PINK HEART DOTS HOT WATER BOTTLE,147.88,-41,12
CUBIC MUG FLOCK PINK ON BROWN,146.91,-39,34
BATHROOM SCALES RUBBER DUCKS,146.85,43,21
NUMBER TILE COTTAGE GARDEN 0 ,146.6,64,20
NUMBER TILE VINTAGE FONT 7,146.43,87,25
GREEN GEISHA GIRL ,146.05,46,28
FRUIT SALAD BAG CHARM,145.52,64,45
NUMBER TILE COTTAGE GARDEN 5,145.5,60,26
FUSCHIA FLOWER PURSE WITH BEADS,145.17000000000002,143,15
WHITE 3 FRAME BIRDS AND TREE ,145.05,17,12
GIRLS PARTY BAG,144.43,47,13
RED DAISY POCKET BOOK ,144.29,167,33
MIRRORED WALL ART LADIES,144.03,164,33
ASSORTED COLOUR METAL CAT ,143.75,115,25
SET/20 FRUIT SALAD PAPER NAPKINS ,143.44,91,26
BLUE GEISHA GIRL ,142.32999999999998,43,26
BOTANICAL ROSE GREETING CARD,141.95,287,23
GREEN FERN NOTEBOOK,141.24,69,48
CHALKBOARD KITCHEN ORGANISER,141.23000000000002,-5,11
BLUE POLKADOT PURSE ,141.15,44,33
WHITE  ROSEBUD PEARL BRACELET,140.98,24,16
S/6 SEW ON CROCHET FLOWERS,140.02,110,20
UNION JACK HOT WATER BOTTLE ,139.86,14,4
VINTAGE ZINC WATERING CAN,139.39999999999998,13,8
NUMBER TILE COTTAGE GARDEN 8,138.81,61,20
BLUE DAISY MOBILE,138.76,172,12
EASTER BUNNY WREATH,138.6,-2,11
SET 4 PICNIC CUTLERY CHERRY ,138.45,71,9
ABSTRACT CIRCLES POCKET BOOK,137.7,108,43
AMETHYST GLASS/SHELL/PEARL NECKLACE,137.63,15,14
ASSORTED SANSKRIT MINI NOTEBOOK,136.25,-30,7
NUMBER TILE COTTAGE GARDEN 9,136.16,62,20
GOLD SCROLL GLASS T-LIGHT HOLDER,136.04999999999998,116,8
BLUE CHARLIE+LOLA PERSONAL DOORSIGN,134.83,889,113
YELLOW EASTER EGG HUNT START POST,134.78,68,21
VINTAGE ENAMEL & CRYSTAL EARRINGS,134.7,27,18
SUMMER BUTTERFLIES BAG CHARM,134.53,54,31
CAKES AND RABBITS DESIGN FLANNEL ,134.48999999999998,119,50
ICON PLACEMAT POP ART ELVIS,134.37,832,33
NEW BAROQUE LARGE NECKLACE BLK/WHIT,134.16,16,14
POLYESTER FILLER PAD 30CMx30CM,133.75,117,27
GOLD WINE GOBLET,132.72,66,9
PINK/YELLOW FLOWERS HANDBAG,132.5,18,9
BANK ACCOUNT  GREETING  CARD ,132.44,287,39
PURPLE ACRYLIC FACETED BANGLE,132.05,79,9
EASTER BUNNY HANGING GARLAND,131.98,67,24
FRENCH PAISLEY CUSHION COVER,131.14000000000001,158,18
PINK ROSEBUD PEARL BRACELET,130.67,12,15
RED   ACRYLIC FACETED BANGLE,130.51000000000002,89,11
PIG MUG IN TWO COLOUR DESIGNS,130.26999999999998,133,20
MOROCCAN BEATEN METAL DISH,130.23999999999998,12,7
STRIPES DESIGN TEDDY,130.04999999999998,28,32
COPPER/OLIVE GREEN FLOWER NECKLACE,129.85,21,14
VINTAGE KITCHEN PRINT SEAFOOD,129.63,12,15
PINK PILLAR CANDLE SILVER FLOCK,129.47,81,19
RED PUDDING SPOON,128.63,881,72
IVY HEART WREATH,128.6,-24,15
SILVER APERITIF GLASS,128.4,107,10
PINK/BLUE STRING CURTAIN ,128.32999999999998,57,5
HEART T-LIGHT HOLDER,128.26999999999998,92,14
SCENTED CANDLE IN DIGITALIS TIN,128.14,49,14
POPART RECT PENCIL SHARPENER ASST,127.56,1058,34
BLACK+WHITE NECKLACE W TASSEL,127.24,-15,10
BEADED PEARL HEART WHITE LARGE,127.05,54,11
NUMBER TILE VINTAGE FONT 8,126.78,78,23
SET 4 PICNIC CUTLERY FONDANT,126.75,65,6
CREAM SWEETHEART WALL CABINET,126.65,-2,7
SNACK TRAY RED GINGHAM,125.72,60,14
SPRIG LAVENDER ARTIFICIAL FLOWER,125.32,-182,13
SMALL WHITE/PINK ROSE ART FLOWER,125.07,111,10
NUMBER TILE VINTAGE FONT 9 ,124.97999999999999,76,21
HEN HOUSE W CHICK STANDING,123.67,292,29
OYSTER TRINKET BOX,123.66,54,19
WOODLAND LARGE BLUE FELT HEART,123.47,92,13
POLKADOT MUG PINK ,123.3,70,14
PURPLE GEMSTONE BRACELET,122.84,-26,11
CANDY SPOT HEART DECORATION,122.08,116,53
TURQUOISE GLASS TASSLE BAG CHARM ,121.38,57,20
PINK B'FLY C/COVER W BOBBLES,121.07,41,15
"RETRO ""TEA FOR ONE"" ",120.99,24,20
ZINC HEART LATTICE 2 WALL PLANTER,120.64999999999999,19,11
DAISY HAIR BAND,120.53,73,38
PAIR BUTTERFLY HAIR CLIPS,120.34,4,18
VINTAGE ZINC PLANTER  ,120.08,32,11
DAISY FOLKART HEART DECORATION,120.0,48,18
ANT COPPER RED BOUDICCA BRACELET,119.91,24,21
BLUE MURANO TWIST NECKLACE,119.89,12,11
PACK 3 FIRE ENGINE/CAR PATCHES,119.65,49,21
FROSTED WHITE BASE ,119.64,239,23
TURQUOISE CRYSTAL+GLASS BRACELET,119.23,24,11
GROOVY CACTUS INFLATABLE,119.08999999999999,495,24
SPACE CADET WHITE,119.03,98,30
PINK OVAL JEWELLED MIRROR,119.0,26,12
